Year,Board Code,Board Name,School Code,School Name,School Total
2009-2010,54,HALIFAX REGIONAL              ,519,BROOKHOUSE ELEMENTARY SCHOOL  ,321
2009-2010,54,HALIFAX REGIONAL              ,286,BROOKSIDE JUNIOR HIGH SCHOOL  ,385
2009-2010,54,HALIFAX REGIONAL              ,595,BURTON ETTINGER ELEMENTARY SCHOOL    ,316
2009-2010,54,HALIFAX REGIONAL              ,319,CALDWELL ROAD ELEMENTARY SCHOOL,308
2009-2010,54,HALIFAX REGIONAL              ,516,CALEDONIA JUNIOR HIGH SCHOOL  ,355
2009-2010,54,HALIFAX REGIONAL              ,312,CAUDLE PARK ELEMENTARY SCHOOL ,208
2009-2010,54,HALIFAX REGIONAL              ,743,CAVALIER DRIVE SCHOOL         ,412
2009-2010,54,HALIFAX REGIONAL              ,611,CENTRAL SPRYFIELD SCHOOL      ,153
2009-2010,54,HALIFAX REGIONAL              ,358,CHARLES P. ALLEN HIGH SCHOOL  ,1177
2009-2010,54,HALIFAX REGIONAL              ,596,CHEBUCTO HEIGHTS ELEMENTARY SCHOOL   ,270
2009-2010,54,HALIFAX REGIONAL              ,1109,CITADEL HIGH SCHOOL           ,1377
2009-2010,54,HALIFAX REGIONAL              ,600,CLAYTON PARK JUNIOR HIGH SCHOOL     ,332
2009-2010,54,HALIFAX REGIONAL              ,352,COLBY VILLAGE ELEMENTARY SCHOOL      ,231
2009-2010,54,HALIFAX REGIONAL              ,357,COLE HARBOUR DISTRICT HIGH SCHOOL   ,1006
2009-2010,54,HALIFAX REGIONAL              ,339,COLONEL JOHN STUART ELEMENTARY SCHOOL,195
2009-2010,54,HALIFAX REGIONAL              ,517,CRICHTON PARK ELEMENTARY SCHOOL      ,231
2009-2010,54,HALIFAX REGIONAL              ,605,CUNARD JUNIOR HIGH SCHOOL     ,199
2009-2010,54,HALIFAX REGIONAL              ,518,DARTMOUTH HIGH SCHOOL         ,1025
2009-2010,54,HALIFAX REGIONAL              ,601,DUC D'ANVILLE ELEMENTARY SCHOOL      ,316
2009-2010,54,HALIFAX REGIONAL              ,328,DUNCAN MACMILLAN HIGH SCHOOL  ,216
2009-2010,54,HALIFAX REGIONAL              ,343,DUTCH SETTLEMENT ELEMENTARY SCHOOL  ,109
2009-2010,54,HALIFAX REGIONAL              ,283,EAST ST. MARGARET'S ELEMENTARY SCHOOL      ,52
2009-2010,54,HALIFAX REGIONAL              ,329,EASTERN CONSOLIDATED ELEMENTARY SCHOOL     ,12
2009-2010,54,HALIFAX REGIONAL              ,351,EASTERN PASSAGE EDUCATION CENTRE   ,460
2009-2010,54,HALIFAX REGIONAL              ,334,EASTERN SHORE DISTRICT HIGH SCHOOL ,565
2009-2010,54,HALIFAX REGIONAL              ,614,ELIZABETH SUTHERLAND SCHOOL   ,296
2009-2010,54,HALIFAX REGIONAL              ,538,ELLENVALE JUNIOR HIGH SCHOOL  ,427
2009-2010,54,HALIFAX REGIONAL              ,564,ERIC GRAVES MEMORIAL JUNIOR HIGH SCHOOL  ,206
2009-2010,54,HALIFAX REGIONAL              ,599,FAIRVIEW HEIGHTS ELEMENTARY SCHOOL  ,254
2009-2010,54,HALIFAX REGIONAL              ,578,FAIRVIEW JUNIOR HIGH SCHOOL   ,379
2009-2010,54,HALIFAX REGIONAL              ,288,FIVE BRIDGES JUNIOR HIGH SCHOOL     ,568
2009-2010,54,HALIFAX REGIONAL              ,356,GAETZ BROOK JUNIOR HIGH SCHOOL,347
2009-2010,54,HALIFAX REGIONAL              ,731,GEORGE BISSETT ELEMENTARY SCHOOL   ,154
2009-2010,54,HALIFAX REGIONAL              ,314,GEORGES P. VANIER JUNIOR HIGH SCHOOL,441
2009-2010,54,HALIFAX REGIONAL              ,350,GERTRUDE M. PARKER ELEMENTARY SCHOOL ,269
2009-2010,54,HALIFAX REGIONAL              ,568,GORSEBROOK JUNIOR HIGH SCHOOL ,193
2009-2010,54,HALIFAX REGIONAL              ,318,GRAHAM CREIGHTON JUNIOR HIGH SCHOOL  ,390
2009-2010,54,HALIFAX REGIONAL              ,602,GROSVENOR-WENTWORTH PARK ELEMENTARY SCHOOL ,410
2009-2010,54,HALIFAX REGIONAL              ,567,HALIFAX CENTRAL JUNIOR HIGH SCHOOL,216
2009-2010,54,HALIFAX REGIONAL              ,8054,HALIFAX DSEPS                 ,104
2009-2010,54,HALIFAX REGIONAL              ,592,HALIFAX WEST HIGH SCHOOL      ,1460
2009-2010,54,HALIFAX REGIONAL              ,306,HAMMONDS PLAINS CONSOLIDATED SCHOOL ,572
2009-2010,54,HALIFAX REGIONAL              ,521,HARBOUR VIEW ELEMENTARY SCHOOL,244
2009-2010,54,HALIFAX REGIONAL              ,740,HAROLD T. BARRETT JUNIOR HIGH SCHOOL,163
2009-2010,54,HALIFAX REGIONAL              ,296,HARRIETSFIELD ELEMENTARY SCHOOL      ,181
2009-2010,54,HALIFAX REGIONAL              ,313,HARRY R. HAMILTON ELEMENTARY SCHOOL ,485
2009-2010,54,HALIFAX REGIONAL              ,522,HAWTHORN ELEMENTARY SCHOOL    ,198
2009-2010,54,HALIFAX REGIONAL              ,293,HERRING COVE JUNIOR HIGH SCHOOL      ,283
2009-2010,54,HALIFAX REGIONAL              ,571,HIGHLAND PARK JUNIOR HIGH SCHOOL     ,135
2009-2010,54,HALIFAX REGIONAL              ,310,HILLSIDE PARK ELEMENTARY SCHOOL      ,211
2009-2010,54,HALIFAX REGIONAL              ,747,HOLLAND ROAD ELEMENTARY SCHOOL,333
2009-2010,54,HALIFAX REGIONAL              ,327,HUMBER PARK ELEMENTARY SCHOOL ,229
2009-2010,54,HALIFAX REGIONAL              ,523,IAN FORSYTH ELEMENTARY SCHOOL ,346
2009-2010,54,HALIFAX REGIONAL              ,579,INGLIS STREET ELEMENTARY SCHOOL      ,201
2009-2010,54,HALIFAX REGIONAL              ,619,J. L. ILSLEY HIGH SCHOOL      ,770
2009-2010,54,HALIFAX REGIONAL              ,539,JOHN MACNEIL ELEMENTARY SCHOOL,183
2009-2010,54,HALIFAX REGIONAL              ,524,JOHN MARTIN JUNIOR HIGH SCHOOL,205
2009-2010,54,HALIFAX REGIONAL              ,607,JOHN W. MACLEOD-FLEMING TOWER ELEMENTARY SCHOOL ,335
2009-2010,54,HALIFAX REGIONAL              ,354,JOSEPH GILES ELEMENTARY SCHOOL,291
2009-2010,54,HALIFAX REGIONAL              ,569,JOSEPH HOWE ELEMENTARY SCHOOL ,111
2009-2010,54,HALIFAX REGIONAL              ,1103,KINGSWOOD ELEMENTARY SCHOOL   ,596
2009-2010,54,HALIFAX REGIONAL              ,330,LAKEFRONT CONSOLIDATED ELEMENTARY SCHOOL   ,32
2009-2010,54,HALIFAX REGIONAL              ,338,LAKEVIEW CONSOLIDATED SCHOOL        ,355
2009-2010,54,HALIFAX REGIONAL              ,587,LEMARCHANT-ST. THOMAS ELEMENTARY SCHOOL    ,345
2009-2010,54,HALIFAX REGIONAL              ,353,LESLIE THOMAS JUNIOR HIGH SCHOOL   ,343
2009-2010,54,HALIFAX REGIONAL              ,968,LOCKVIEW HIGH SCHOOL          ,1270
2009-2010,54,HALIFAX REGIONAL              ,939,MADELINE SYMONDS MIDDLE SCHOOL,681
2009-2010,54,HALIFAX REGIONAL              ,526,MICHAEL WALLACE ELEMENTARY SCHOOL    ,250
2009-2010,54,HALIFAX REGIONAL              ,748,MILLWOOD ELEMENTARY SCHOOL    ,447
2009-2010,54,HALIFAX REGIONAL              ,745,MILLWOOD HIGH SCHOOL          ,620
2009-2010,54,HALIFAX REGIONAL              ,527,MOUNT EDWARD ELEMENTARY SCHOOL,187
2009-2010,54,HALIFAX REGIONAL              ,1149,MUSQUODOBOIT RURAL HIGH SCHOOL,352
2009-2010,54,HALIFAX REGIONAL              ,348,MUSQUODOBOIT VALLEY EDUCATION CENTRE ,164
2009-2010,54,HALIFAX REGIONAL              ,324,NELSON WHYNDER ELEMENTARY SCHOOL     ,86
2009-2010,54,HALIFAX REGIONAL              ,56,OCEAN VIEW ELEMENTARY SCHOOL  ,304
2009-2010,54,HALIFAX REGIONAL              ,131,O'CONNELL DRIVE ELEMENTARY SCHOOL   ,390
2009-2010,54,HALIFAX REGIONAL              ,315,OLDFIELD CONSOLIDATED SCHOOL  ,132
2009-2010,54,HALIFAX REGIONAL              ,572,OXFORD SCHOOL                 ,331
2009-2010,54,HALIFAX REGIONAL              ,1141,OYSTER POND ACADEMY           ,512
2009-2010,54,HALIFAX REGIONAL              ,970,PARK WEST SCHOOL              ,762
2009-2010,54,HALIFAX REGIONAL              ,969,PORTLAND ESTATES ELEMENTARY SCHOOL   ,369
2009-2010,54,HALIFAX REGIONAL              ,533,PRINCE ANDREW HIGH SCHOOL     ,1066
2009-2010,54,HALIFAX REGIONAL              ,532,PRINCE ARTHUR JUNIOR HIGH SCHOOL     ,402
2009-2010,54,HALIFAX REGIONAL              ,282,PROSPECT ROAD ELEMENTARY SCHOOL     ,278
2009-2010,54,HALIFAX REGIONAL              ,938,RIDGECLIFF MIDDLE SCHOOL      ,510
2009-2010,54,HALIFAX REGIONAL              ,359,ROBERT K. TURNER ELEMENTARY SCHOOL   ,161
2009-2010,54,HALIFAX REGIONAL              ,603,ROCKINGHAM ELEMENTARY SCHOOL  ,368
2009-2010,54,HALIFAX REGIONAL              ,609,ROCKINGSTONE HEIGHTS SCHOOL   ,267
2009-2010,54,HALIFAX REGIONAL              ,321,ROSS ROAD SCHOOL              ,352
2009-2010,54,HALIFAX REGIONAL              ,309,SACKVILLE CENTENNIAL ELEMENTARY SCHOOL    ,107
2009-2010,54,HALIFAX REGIONAL              ,311,SACKVILLE HEIGHTS ELEMENTARY SCHOOL,317
2009-2010,54,HALIFAX REGIONAL              ,303,SACKVILLE HEIGHTS JUNIOR HIGH SCHOOL ,579
2009-2010,54,HALIFAX REGIONAL              ,297,SACKVILLE HIGH SCHOOL         ,908
2009-2010,54,HALIFAX REGIONAL              ,581,SAINT MARY'S ELEMENTARY SCHOOL,117
2009-2010,54,HALIFAX REGIONAL              ,295,SAMBRO ELEMENTARY SCHOOL      ,106
2009-2010,54,HALIFAX REGIONAL              ,941,SEASIDE ELEMENTARY SCHOOL     ,355
2009-2010,54,HALIFAX REGIONAL              ,534,SHANNON PARK ELEMENTARY SCHOOL,583
2009-2010,54,HALIFAX REGIONAL              ,287,SHATFORD MEMORIAL ELEMENTARY SCHOOL  ,78
2009-2010,54,HALIFAX REGIONAL              ,332,SHEET HARBOUR CONSOLIDATED SCHOOL    ,139
2009-2010,54,HALIFAX REGIONAL              ,589,SIR CHARLES TUPPER SCHOOL     ,293
2009-2010,54,HALIFAX REGIONAL              ,277,SIR JOHN A. MACDONALD HIGH SCHOOL   ,949
2009-2010,54,HALIFAX REGIONAL              ,320,SIR ROBERT BORDEN JUNIOR HIGH SCHOOL ,258
2009-2010,54,HALIFAX REGIONAL              ,355,SMOKEY DRIVE ELEMENTARY SCHOOL,232
2009-2010,54,HALIFAX REGIONAL              ,535,SOUTH WOODSIDE SCHOOL         ,153
2009-2010,54,HALIFAX REGIONAL              ,540,SOUTHDALE-NORTH WOODSIDE SCHOOL      ,320
2009-2010,54,HALIFAX REGIONAL              ,593,SPRINGVALE ELEMENTARY SCHOOL  ,254
2009-2010,54,HALIFAX REGIONAL              ,575,ST. AGNES JUNIOR HIGH SCHOOL  ,288
2009-2010,54,HALIFAX REGIONAL              ,577,ST. CATHERINE'S ELEMENTARY SCHOOL,329
2009-2010,54,HALIFAX REGIONAL              ,580,ST. JOSEPH'S-ALEXANDER MCKAY ELEMENTARY SCHOOL ,244
2009-2010,54,HALIFAX REGIONAL              ,940,ST. MARGARET'S BAY ELEMENTARY SCHOOL,398
2009-2010,54,HALIFAX REGIONAL              ,583,ST. PATRICK'S-ALEXANDRA SCHOOL       ,83
2009-2010,54,HALIFAX REGIONAL              ,586,ST. STEPHEN'S ELEMENTARY SCHOOL      ,208
2009-2010,54,HALIFAX REGIONAL              ,299,SUNNYSIDE ELEMENTARY SCHOOL   ,552
2009-2010,54,HALIFAX REGIONAL              ,307,SYCAMORE LANE ELEMENTARY SCHOOL     ,249
2009-2010,54,HALIFAX REGIONAL              ,85,TALLAHASSEE COMMUNITY SCHOOL  ,420
2009-2010,54,HALIFAX REGIONAL              ,284,TANTALLON SENIOR ELEMENTARY SCHOOL  ,738
2009-2010,54,HALIFAX REGIONAL              ,349,UPPER MUSQUODOBOIT CONSOLIDATED ELEMENTARY SCHOOL  ,56
2009-2010,54,HALIFAX REGIONAL              ,316,WAVERLEY MEMORIAL-L. C. SKERRY SCHOOL,162
2009-2010,54,HALIFAX REGIONAL              ,591,WESTMOUNT ELEMENTARY SCHOOL   ,363
2009-2010,54,HALIFAX REGIONAL              ,294,WILLIAM KING ELEMENTARY SCHOOL,264
2009-2010,55,ANNAPOLIS VALLEY REGIONAL     ,63,ALDERSHOT ELEMENTARY SCHOOL   ,333
2009-2010,55,ANNAPOLIS VALLEY REGIONAL     ,746,ANNAPOLIS EAST ELEMENTARY SCHOOL     ,508
2009-2010,55,ANNAPOLIS VALLEY REGIONAL     ,706,ANNAPOLIS ROYAL REGIONAL ACADEMY   ,193
2009-2010,55,ANNAPOLIS VALLEY REGIONAL     ,8055,ANNAPOLIS VALLEY DSEPS        ,9
2009-2010,55,ANNAPOLIS VALLEY REGIONAL     ,133,ANNAPOLIS WEST EDUCATION CENTRE ,296
2009-2010,55,ANNAPOLIS VALLEY REGIONAL     ,993,AVON VIEW HIGH SCHOOL         ,812
2009-2010,55,ANNAPOLIS VALLEY REGIONAL     ,75,BERWICK AND DISTRICT SCHOOL   ,393
2009-2010,55,ANNAPOLIS VALLEY REGIONAL     ,507,BRIDGETOWN REGIONAL ELEMENTARY SCHOOL,180
2009-2010,55,ANNAPOLIS VALLEY REGIONAL     ,708,BRIDGETOWN REGIONAL HIGH SCHOOL    ,386
2009-2010,55,ANNAPOLIS VALLEY REGIONAL     ,363,BROOKLYN DISTRICT ELEMENTARY SCHOOL  ,347
2009-2010,55,ANNAPOLIS VALLEY REGIONAL     ,58,CAMBRIDGE AND DISTRICT ELEMENTARY SCHOOL  ,244
2009-2010,55,ANNAPOLIS VALLEY REGIONAL     ,67,CENTRAL KINGS RURAL HIGH SCHOOL      ,803
2009-2010,55,ANNAPOLIS VALLEY REGIONAL     ,965,CHAMPLAIN ELEMENTARY SCHOOL   ,199
2009-2010,55,ANNAPOLIS VALLEY REGIONAL     ,141,CLARK RUTHERFORD MEMORIAL SCHOOL     ,141
2009-2010,55,ANNAPOLIS VALLEY REGIONAL     ,732,COLDBROOK AND DISTRICT SCHOOL ,537
2009-2010,55,ANNAPOLIS VALLEY REGIONAL     ,366,DR. ARTHUR HINES ELEMENTARY SCHOOL   ,137
2009-2010,55,ANNAPOLIS VALLEY REGIONAL     ,65,DWIGHT ROSS SCHOOL            ,203
2009-2010,55,ANNAPOLIS VALLEY REGIONAL     ,753,EVANGELINE MIDDLE SCHOOL      ,321
2009-2010,55,ANNAPOLIS VALLEY REGIONAL     ,362,FALMOUTH DISTRICT SCHOOL      ,242
2009-2010,55,ANNAPOLIS VALLEY REGIONAL     ,60,GASPEREAU VALLEY ELEMENTARY SCHOOL   ,179
2009-2010,55,ANNAPOLIS VALLEY REGIONAL     ,59,GLOOSCAP ELEMENTARY SCHOOL    ,246
2009-2010,55,ANNAPOLIS VALLEY REGIONAL     ,24,HANTSPORT SCHOOL              ,210
2009-2010,55,ANNAPOLIS VALLEY REGIONAL     ,998,HIGHBURY EDUCATION CENTRE     ,21
2009-2010,55,ANNAPOLIS VALLEY REGIONAL     ,70,HORTON HIGH SCHOOL            ,989
2009-2010,55,ANNAPOLIS VALLEY REGIONAL     ,76,KINGS COUNTY ACADEMY          ,579
2009-2010,55,ANNAPOLIS VALLEY REGIONAL     ,379,KINGS COUNTY ADULT HIGH SCHOOL,48
2009-2010,55,ANNAPOLIS VALLEY REGIONAL     ,62,KINGSTON & DISTRICT SCHOOL    ,460
2009-2010,55,ANNAPOLIS VALLEY REGIONAL     ,61,L. E. SHAW ELEMENTARY SCHOOL  ,149
2009-2010,55,ANNAPOLIS VALLEY REGIONAL     ,129,LAWRENCETOWN CONSOLIDATED SCHOOL,158
2009-2010,55,ANNAPOLIS VALLEY REGIONAL     ,1108,LAWRENCETOWN EDUCATION CENTRE ,27
2009-2010,55,ANNAPOLIS VALLEY REGIONAL     ,712,MIDDLETON REGIONAL HIGH SCHOOL       ,640
2009-2010,55,ANNAPOLIS VALLEY REGIONAL     ,73,NEW MINAS ELEMENTARY SCHOOL   ,356
2009-2010,55,ANNAPOLIS VALLEY REGIONAL     ,364,NEWPORT STATION DISTRICT SCHOOL,93
2009-2010,55,ANNAPOLIS VALLEY REGIONAL     ,967,NORTHEAST KINGS EDUCATION CENTRE   ,1080
2009-2010,55,ANNAPOLIS VALLEY REGIONAL     ,966,PINE RIDGE MIDDLE SCHOOL      ,464
2009-2010,55,ANNAPOLIS VALLEY REGIONAL     ,72,PORT WILLIAMS ELEMENTARY SCHOOL     ,250
2009-2010,55,ANNAPOLIS VALLEY REGIONAL     ,55,SOMERSET AND DISTRICT ELEMENTARY SCHOOL    ,179
2009-2010,55,ANNAPOLIS VALLEY REGIONAL     ,54,ST. MARY'S ELEMENTARY SCHOOL  ,187
2009-2010,55,ANNAPOLIS VALLEY REGIONAL     ,360,THREE MILE PLAINS DISTRICT SCHOOL    ,154
2009-2010,55,ANNAPOLIS VALLEY REGIONAL     ,1110,WEST HANTS EDUCATION CENTRE   ,19
2009-2010,55,ANNAPOLIS VALLEY REGIONAL     ,994,WEST HANTS MIDDLE SCHOOL      ,619
2009-2010,55,ANNAPOLIS VALLEY REGIONAL     ,71,WEST KINGS DISTRICT HIGH SCHOOL     ,696
2009-2010,55,ANNAPOLIS VALLEY REGIONAL     ,376,WINDSOR ADULT HIGH SCHOOL     ,24
2009-2010,55,ANNAPOLIS VALLEY REGIONAL     ,699,WINDSOR ELEMENTARY SCHOOL     ,196
2009-2010,55,ANNAPOLIS VALLEY REGIONAL     ,361,WINDSOR FORKS DISTRICT SCHOOL ,165
2009-2010,55,ANNAPOLIS VALLEY REGIONAL     ,81,WOLFVILLE SCHOOL              ,423
2009-2010,57,ACADIEN PROVINCIAL            ,387,CENTRE SCOLAIRE ETOILE DE L'ACADIE,249
2009-2010,57,ACADIEN PROVINCIAL            ,145,ECOLE ACADIENNE DE POMQUET    ,241
2009-2010,57,ACADIEN PROVINCIAL            ,433,ECOLE ACADIENNE DE TRURO      ,168
2009-2010,57,ACADIEN PROVINCIAL            ,947,ECOLE BEAUBASSIN              ,583
2009-2010,57,ACADIEN PROVINCIAL            ,982,ECOLE BEAU-PORT               ,253
2009-2010,57,ACADIEN PROVINCIAL            ,744,ECOLE BELLEVILLE              ,149
2009-2010,57,ACADIEN PROVINCIAL            ,948,ECOLE BOIS-JOLI               ,449
2009-2010,57,ACADIEN PROVINCIAL            ,434,ECOLE DE LA RIVE-SUD          ,124
2009-2010,57,ACADIEN PROVINCIAL            ,68,ECOLE DU CARREFOUR            ,489
2009-2010,57,ACADIEN PROVINCIAL            ,218,ECOLE JEAN-MARIE-GAY          ,109
2009-2010,57,ACADIEN PROVINCIAL            ,217,ECOLE JOSEPH-DUGAS            ,154
2009-2010,57,ACADIEN PROVINCIAL            ,378,ECOLE NDA                     ,213
2009-2010,57,ACADIEN PROVINCIAL            ,156,ECOLE PUBNICO-OUEST           ,184
2009-2010,57,ACADIEN PROVINCIAL            ,57,ECOLE ROSE-DES-VENTS          ,193
2009-2010,57,ACADIEN PROVINCIAL            ,221,ECOLE SAINT-ALBERT            ,40
2009-2010,57,ACADIEN PROVINCIAL            ,225,ECOLE SECONDAIRE DE CLARE     ,269
2009-2010,57,ACADIEN PROVINCIAL            ,980,ECOLE SECONDAIRE DE PAR-EN-BAS,326
2009-2010,57,ACADIEN PROVINCIAL            ,219,ECOLE STELLA-MARIS            ,147
2009-2010,57,ACADIEN PROVINCIAL            ,160,ECOLE WEDGEPORT               ,106
2009-2010,58,SOUTH SHORE REGIONAL          ,925,ASPOTOGAN CONSOLIDATED ELEMENTARY SCHOOL ,156
2009-2010,58,SOUTH SHORE REGIONAL          ,926,BAYVIEW COMMUNITY SCHOOL      ,430
2009-2010,58,SOUTH SHORE REGIONAL          ,405,BIG TANCOOK ELEMENTARY SCHOOL ,5
2009-2010,58,SOUTH SHORE REGIONAL          ,509,BRIDGEWATER ELEMENTARY SCHOOL ,518
2009-2010,58,SOUTH SHORE REGIONAL          ,508,BRIDGEWATER JUNIOR SENIOR HIGH SCHOOL,464
2009-2010,58,SOUTH SHORE REGIONAL          ,399,CENTRE CONSOLIDATED SCHOOL         ,417
2009-2010,58,SOUTH SHORE REGIONAL          ,216,CHESTER AREA MIDDLE SCHOOL    ,327
2009-2010,58,SOUTH SHORE REGIONAL          ,207,CHESTER DISTRICT ELEMENTARY SCHOOL   ,231
2009-2010,58,SOUTH SHORE REGIONAL          ,386,DR. JOHN C. WICKWIRE ACADEMY  ,376
2009-2010,58,SOUTH SHORE REGIONAL          ,80,FOREST HEIGHTS COMMUNITY SCHOOL  ,357
2009-2010,58,SOUTH SHORE REGIONAL          ,210,GOLD RIVER-WESTERN SHORE SCHOOL     ,99
2009-2010,58,SOUTH SHORE REGIONAL          ,1102,GORHAM MEMORIAL EDUCATION CENTRE   ,8
2009-2010,58,SOUTH SHORE REGIONAL          ,1150,GREENFIELD ELEMENTARY SCHOOL  ,37
2009-2010,58,SOUTH SHORE REGIONAL          ,917,HEBBVILLE ACADEMY             ,543
2009-2010,58,SOUTH SHORE REGIONAL          ,710,LIVERPOOL REGIONAL HIGH SCHOOL,321
2009-2010,58,SOUTH SHORE REGIONAL          ,628,LUNENBURG ACADEMY             ,99
2009-2010,58,SOUTH SHORE REGIONAL          ,979,LUNENBURG ADULT HIGH SCHOOL          ,45
2009-2010,58,SOUTH SHORE REGIONAL          ,627,LUNENBURG JUNIOR HIGH SCHOOL        ,91
2009-2010,58,SOUTH SHORE REGIONAL          ,465,MILL VILLAGE CONSOLIDATED SCHOOL   ,55
2009-2010,58,SOUTH SHORE REGIONAL          ,463,MILTON CENTENNIAL SCHOOL             ,131
2009-2010,58,SOUTH SHORE REGIONAL          ,397,NEW GERMANY ELEMENTARY SCHOOL ,212
2009-2010,58,SOUTH SHORE REGIONAL          ,402,NEW GERMANY RURAL HIGH SCHOOL ,371
2009-2010,58,SOUTH SHORE REGIONAL          ,214,NEW ROSS CONSOLIDATED SCHOOL  ,142
2009-2010,58,SOUTH SHORE REGIONAL          ,404,NEWCOMBVILLE ELEMENTARY SCHOOL,174
2009-2010,58,SOUTH SHORE REGIONAL          ,459,NORTH QUEENS COMMUNITY SCHOOL ,140
2009-2010,58,SOUTH SHORE REGIONAL          ,460,NORTH QUEENS ELEMENTARY SCHOOL,129
2009-2010,58,SOUTH SHORE REGIONAL          ,409,PARK VIEW EDUCATION CENTRE    ,876
2009-2010,58,SOUTH SHORE REGIONAL          ,400,PENTZ ELEMENTARY SCHOOL       ,98
2009-2010,58,SOUTH SHORE REGIONAL          ,401,PETITE RIVIERE ELEMENTARY SCHOOL     ,84
2009-2010,58,SOUTH SHORE REGIONAL          ,439,QUEENS ADULT HIGH SCHOOL      ,33
2009-2010,58,SOUTH SHORE REGIONAL          ,392,RIVERPORT & DISTRICT ELEMENTARY SCHOOL     ,43
2009-2010,58,SOUTH SHORE REGIONAL          ,53,SOUTH QUEENS JUNIOR HIGH SCHOOL      ,295
2009-2010,58,SOUTH SHORE REGIONAL          ,380,SOUTH SHORE ALTERNATE SCHOOL-BRIDGEWATER ,16
2009-2010,58,SOUTH SHORE REGIONAL          ,1107,SOUTH SHORE ALTERNATE SCHOOL-MAHONE BAY  ,7
2009-2010,58,SOUTH SHORE REGIONAL          ,8058,SOUTH SHORE DSEPS             ,1
2009-2010,58,SOUTH SHORE REGIONAL          ,394,WEST NORTHFIELD ELEMENTARY SCHOOL   ,179
2009-2010,59,TRI-COUNTY REGIONAL           ,500,ARCADIA CONSOLIDATED ELEMENTARY SCHOOL   ,244
2009-2010,59,TRI-COUNTY REGIONAL           ,167,BARRINGTON MUNICIPAL HIGH SCHOOL     ,682
2009-2010,59,TRI-COUNTY REGIONAL           ,255,BARTON CONSOLIDATED SCHOOL    ,58
2009-2010,59,TRI-COUNTY REGIONAL           ,166,CAPE SABLE ISLAND ELEMENTARY SCHOOL ,89
2009-2010,59,TRI-COUNTY REGIONAL           ,497,CARLETON CONSOLIDATED SCHOOL  ,106
2009-2010,59,TRI-COUNTY REGIONAL           ,511,CLARK'S HARBOUR ELEMENTARY SCHOOL    ,115
2009-2010,59,TRI-COUNTY REGIONAL           ,272,DIGBY ADULT HIGH SCHOOL       ,38
2009-2010,59,TRI-COUNTY REGIONAL           ,541,DIGBY ELEMENTARY SCHOOL       ,367
2009-2010,59,TRI-COUNTY REGIONAL           ,257,DIGBY NECK CONSOLIDATED SCHOOL,36
2009-2010,59,TRI-COUNTY REGIONAL           ,709,DIGBY REGIONAL HIGH SCHOOL         ,506
2009-2010,59,TRI-COUNTY REGIONAL           ,981,DRUMLIN HEIGHTS CONSOLIDATED SCHOOL ,412
2009-2010,59,TRI-COUNTY REGIONAL           ,733,EVELYN RICHARDSON MEMORIAL ELEMENTARY SCHOOL ,147
2009-2010,59,TRI-COUNTY REGIONAL           ,927,FOREST RIDGE ACADEMY          ,207
2009-2010,59,TRI-COUNTY REGIONAL           ,79,HILLCREST ACADEMY             ,273
2009-2010,59,TRI-COUNTY REGIONAL           ,259,ISLANDS CONSOLIDATED SCHOOL   ,116
2009-2010,59,TRI-COUNTY REGIONAL           ,624,LOCKEPORT ELEMENTARY SCHOOL   ,109
2009-2010,59,TRI-COUNTY REGIONAL           ,711,LOCKEPORT REGIONAL HIGH SCHOOL      ,146
2009-2010,59,TRI-COUNTY REGIONAL           ,410,MAPLE GROVE EDUCATION CENTRE  ,467
2009-2010,59,TRI-COUNTY REGIONAL           ,928,MEADOWFIELDS COMMUNITY SCHOOL ,509
2009-2010,59,TRI-COUNTY REGIONAL           ,199,PLYMOUTH SCHOOL               ,168
2009-2010,59,TRI-COUNTY REGIONAL           ,498,PORT MAITLAND CONSOLIDATED SCHOOL  ,152
2009-2010,59,TRI-COUNTY REGIONAL           ,716,SHELBURNE REGIONAL HIGH SCHOOL,356
2009-2010,59,TRI-COUNTY REGIONAL           ,703,SOUTH CENTENNIAL SCHOOL       ,125
2009-2010,59,TRI-COUNTY REGIONAL           ,977,ST. MARY'S BAY ACADEMY        ,267
2009-2010,59,TRI-COUNTY REGIONAL           ,8059,TRI-COUNTY DSEPS              ,1
2009-2010,59,TRI-COUNTY REGIONAL           ,258,WESTPORT VILLAGE SCHOOL,12
2009-2010,59,TRI-COUNTY REGIONAL           ,256,WEYMOUTH CONSOLIDATED SCHOOL  ,242
2009-2010,59,TRI-COUNTY REGIONAL           ,385,YARMOUTH ADULT HIGH SCHOOL    ,35
2009-2010,59,TRI-COUNTY REGIONAL           ,704,YARMOUTH CENTRAL SCHOOL       ,203
2009-2010,59,TRI-COUNTY REGIONAL           ,700,YARMOUTH CONSOLIDATED MEMORIAL HIGH SCHOOL   ,700
2009-2010,59,TRI-COUNTY REGIONAL           ,701,YARMOUTH JUNIOR HIGH SCHOOL         ,264
2010-2011,51,CAPE BRETON-VICTORIA REGIONAL ,96,BADDECK ACADEMY               ,317
2010-2011,51,CAPE BRETON-VICTORIA REGIONAL ,93,BOULARDERIE ELEMENTARY SCHOOL ,89
2010-2011,51,CAPE BRETON-VICTORIA REGIONAL ,101,BRAS D'OR ELEMENTARY SCHOOL   ,304
2010-2011,51,CAPE BRETON-VICTORIA REGIONAL ,640,BRETON EDUCATION CENTRE       ,668
2010-2011,51,CAPE BRETON-VICTORIA REGIONAL ,551,BRIDGEPORT SCHOOL             ,107
2010-2011,51,CAPE BRETON-VICTORIA REGIONAL ,995,BROOKLAND ELEMENTARY SCHOOL   ,463
2010-2011,51,CAPE BRETON-VICTORIA REGIONAL ,107,CABOT EDUCATION CENTRE        ,228
2010-2011,51,CAPE BRETON-VICTORIA REGIONAL ,962,CAPE SMOKEY ELEMENTARY SCHOOL ,110
2010-2011,51,CAPE BRETON-VICTORIA REGIONAL ,186,COXHEATH ELEMENTARY SCHOOL    ,280
2010-2011,51,CAPE BRETON-VICTORIA REGIONAL ,1101,CUSACK SCHOOL                 ,377
2010-2011,51,CAPE BRETON-VICTORIA REGIONAL ,996,DONKIN SCHOOL                 ,141
2010-2011,51,CAPE BRETON-VICTORIA REGIONAL ,98,DR. T. L. SULLIVAN MIDDLE SCHOOL     ,265
2010-2011,51,CAPE BRETON-VICTORIA REGIONAL ,1153,FERRISVIEW ELEMENTARY SCHOOL  ,222
2010-2011,51,CAPE BRETON-VICTORIA REGIONAL ,99,FLORENCE ELEMENTARY SCHOOL    ,127
2010-2011,51,CAPE BRETON-VICTORIA REGIONAL ,626,GEORGE D. LEWIS SCHOOL        ,114
2010-2011,51,CAPE BRETON-VICTORIA REGIONAL ,442,GLACE BAY ADULT EDUCATION CENTRE   ,70
2010-2011,51,CAPE BRETON-VICTORIA REGIONAL ,416,GLACE BAY ELEMENTARY SCHOOL   ,495
2010-2011,51,CAPE BRETON-VICTORIA REGIONAL ,8,GLACE BAY HIGH SCHOOL         ,794
2010-2011,51,CAPE BRETON-VICTORIA REGIONAL ,964,HARBOURSIDE ELEMENTARY SCHOOL ,395
2010-2011,51,CAPE BRETON-VICTORIA REGIONAL ,668,HOLY ANGELS HIGH SCHOOL             ,288
2010-2011,51,CAPE BRETON-VICTORIA REGIONAL ,549,JOHN BERNARD CROAK V. C. MEMORIAL SCHOOL  ,174
2010-2011,51,CAPE BRETON-VICTORIA REGIONAL ,960,JUBILEE ELEMENTARY SCHOOL     ,252
2010-2011,51,CAPE BRETON-VICTORIA REGIONAL ,545,MACDONALD ELEMENTARY SCHOOL         ,125
2010-2011,51,CAPE BRETON-VICTORIA REGIONAL ,206,MACLENNAN MIDDLE SCHOOL       ,152
2010-2011,51,CAPE BRETON-VICTORIA REGIONAL ,202,MALCOLM MUNROE MEMORIAL MIDDLE SCHOOL     ,609
2010-2011,51,CAPE BRETON-VICTORIA REGIONAL ,183,MARION BRIDGE SCHOOL          ,79
2010-2011,51,CAPE BRETON-VICTORIA REGIONAL ,82,MEMORIAL COMPOSITE HIGH SCHOOL,928
2010-2011,51,CAPE BRETON-VICTORIA REGIONAL ,83,MIDDLE RIVER CONSOLIDATED SCHOOL     ,19
2010-2011,51,CAPE BRETON-VICTORIA REGIONAL ,180,MIRA ROAD SCHOOL              ,155
2010-2011,51,CAPE BRETON-VICTORIA REGIONAL ,643,MOUNT CARMEL ELEMENTARY SCHOOL,151
2010-2011,51,CAPE BRETON-VICTORIA REGIONAL ,997,MOUNTAINVIEW ELEMENTARY SCHOOL,255
2010-2011,51,CAPE BRETON-VICTORIA REGIONAL ,444,NEW WATERFORD ADULT EDUCATION CENTRE ,21
2010-2011,51,CAPE BRETON-VICTORIA REGIONAL ,963,NEW WATERFORD ELEMENTARY SCHOOL ,379
2010-2011,51,CAPE BRETON-VICTORIA REGIONAL ,961,NORTH HIGHLANDS ELEMENTARY SCHOOL    ,100
2010-2011,51,CAPE BRETON-VICTORIA REGIONAL ,929,NORTHSIDE ADULT EDUCATION CENTRE   ,33
2010-2011,51,CAPE BRETON-VICTORIA REGIONAL ,1154,OCEANVIEW EDUCATION CENTRE    ,608
2010-2011,51,CAPE BRETON-VICTORIA REGIONAL ,1142,RANKIN SCHOOL OF THE NARROWS  ,138
2010-2011,51,CAPE BRETON-VICTORIA REGIONAL ,973,RIVERSIDE ELEMENTARY SCHOOL   ,178
2010-2011,51,CAPE BRETON-VICTORIA REGIONAL ,203,RIVERVIEW HIGH SCHOOL         ,886
2010-2011,51,CAPE BRETON-VICTORIA REGIONAL ,182,ROBIN FOOTE ELEMENTARY SCHOOL ,142
2010-2011,51,CAPE BRETON-VICTORIA REGIONAL ,113,SETON ELEMENTARY SCHOOL       ,221
2010-2011,51,CAPE BRETON-VICTORIA REGIONAL ,646,SHERWOOD PARK EDUCATION CENTRE,407
2010-2011,51,CAPE BRETON-VICTORIA REGIONAL ,972,SHIPYARD ELEMENTARY SCHOOL    ,252
2010-2011,51,CAPE BRETON-VICTORIA REGIONAL ,644,ST. AGNES ELEMENTARY SCHOOL   ,147
2010-2011,51,CAPE BRETON-VICTORIA REGIONAL ,561,ST. ANNE'S ELEMENTARY SCHOOL  ,358
2010-2011,51,CAPE BRETON-VICTORIA REGIONAL ,119,ST. JOSEPH ELEMENTARY SCHOOL  ,265
2010-2011,51,CAPE BRETON-VICTORIA REGIONAL ,688,SYDNEY ACADEMY                ,732
