Year,Board Code,Board Name,School Code,School Name,School Total
2012-2013,59,TRI-COUNTY REGIONAL           ,497,CARLETON CONSOLIDATED SCHOOL  ,88
2012-2013,59,TRI-COUNTY REGIONAL           ,511,CLARK'S HARBOUR ELEMENTARY SCHOOL    ,109
2012-2013,59,TRI-COUNTY REGIONAL           ,272,DIGBY ADULT HIGH SCHOOL       ,29
2012-2013,59,TRI-COUNTY REGIONAL           ,541,DIGBY ELEMENTARY SCHOOL       ,379
2012-2013,59,TRI-COUNTY REGIONAL           ,257,DIGBY NECK CONSOLIDATED SCHOOL,38
2012-2013,59,TRI-COUNTY REGIONAL           ,709,DIGBY REGIONAL HIGH SCHOOL         ,466
2012-2013,59,TRI-COUNTY REGIONAL           ,981,DRUMLIN HEIGHTS CONSOLIDATED SCHOOL ,390
2012-2013,59,TRI-COUNTY REGIONAL           ,733,EVELYN RICHARDSON MEMORIAL ELEMENTARY SCHOOL ,116
2012-2013,59,TRI-COUNTY REGIONAL           ,927,FOREST RIDGE ACADEMY          ,198
2012-2013,59,TRI-COUNTY REGIONAL           ,79,HILLCREST ACADEMY             ,298
2012-2013,59,TRI-COUNTY REGIONAL           ,259,ISLANDS CONSOLIDATED SCHOOL   ,126
2012-2013,59,TRI-COUNTY REGIONAL           ,624,LOCKEPORT ELEMENTARY SCHOOL   ,99
2012-2013,59,TRI-COUNTY REGIONAL           ,711,LOCKEPORT REGIONAL HIGH SCHOOL      ,130
2012-2013,59,TRI-COUNTY REGIONAL           ,410,MAPLE GROVE EDUCATION CENTRE  ,388
2012-2013,59,TRI-COUNTY REGIONAL           ,928,MEADOWFIELDS COMMUNITY SCHOOL ,467
2012-2013,59,TRI-COUNTY REGIONAL           ,199,PLYMOUTH SCHOOL               ,97
2012-2013,59,TRI-COUNTY REGIONAL           ,498,PORT MAITLAND CONSOLIDATED SCHOOL  ,145
2012-2013,59,TRI-COUNTY REGIONAL           ,716,SHELBURNE REGIONAL HIGH SCHOOL,301
2012-2013,59,TRI-COUNTY REGIONAL           ,703,SOUTH CENTENNIAL SCHOOL       ,106
2012-2013,59,TRI-COUNTY REGIONAL           ,977,ST. MARY'S BAY ACADEMY        ,253
2012-2013,59,TRI-COUNTY REGIONAL           ,8059,TRI-COUNTY DSEPS              ,1
2012-2013,59,TRI-COUNTY REGIONAL           ,256,WEYMOUTH CONSOLIDATED SCHOOL  ,238
2012-2013,59,TRI-COUNTY REGIONAL           ,385,YARMOUTH ADULT HIGH SCHOOL    ,9
2012-2013,59,TRI-COUNTY REGIONAL           ,704,YARMOUTH CENTRAL SCHOOL       ,204
2012-2013,59,TRI-COUNTY REGIONAL           ,1178,YARMOUTH CONSOLIDATED MEMORIAL HIGH SCHOOL   ,960
2013-2014,51,CAPE BRETON-VICTORIA REGIONAL ,96,BADDECK ACADEMY               ,263
2013-2014,51,CAPE BRETON-VICTORIA REGIONAL ,93,BOULARDERIE ELEMENTARY SCHOOL ,95
2013-2014,51,CAPE BRETON-VICTORIA REGIONAL ,101,BRAS D'OR ELEMENTARY SCHOOL   ,300
2013-2014,51,CAPE BRETON-VICTORIA REGIONAL ,640,BRETON EDUCATION CENTRE       ,585
2013-2014,51,CAPE BRETON-VICTORIA REGIONAL ,551,BRIDGEPORT SCHOOL             ,121
2013-2014,51,CAPE BRETON-VICTORIA REGIONAL ,995,BROOKLAND ELEMENTARY SCHOOL   ,412
2013-2014,51,CAPE BRETON-VICTORIA REGIONAL ,107,CABOT EDUCATION CENTRE        ,198
2013-2014,51,CAPE BRETON-VICTORIA REGIONAL ,1169,CAPE BRETON VICTORIA -ADULT HIGH SCHOOL      ,132
2013-2014,51,CAPE BRETON-VICTORIA REGIONAL ,962,CAPE SMOKEY ELEMENTARY SCHOOL ,92
2013-2014,51,CAPE BRETON-VICTORIA REGIONAL ,186,COXHEATH ELEMENTARY SCHOOL    ,301
2013-2014,51,CAPE BRETON-VICTORIA REGIONAL ,1101,CUSACK SCHOOL                 ,353
2013-2014,51,CAPE BRETON-VICTORIA REGIONAL ,996,DONKIN SCHOOL                 ,124
2013-2014,51,CAPE BRETON-VICTORIA REGIONAL ,98,DR. T. L. SULLIVAN MIDDLE SCHOOL     ,223
2013-2014,51,CAPE BRETON-VICTORIA REGIONAL ,1153,FERRISVIEW ELEMENTARY SCHOOL  ,217
2013-2014,51,CAPE BRETON-VICTORIA REGIONAL ,99,FLORENCE ELEMENTARY SCHOOL    ,129
2013-2014,51,CAPE BRETON-VICTORIA REGIONAL ,626,GEORGE D. LEWIS SCHOOL        ,102
2013-2014,51,CAPE BRETON-VICTORIA REGIONAL ,416,GLACE BAY ELEMENTARY SCHOOL   ,511
2013-2014,51,CAPE BRETON-VICTORIA REGIONAL ,8,GLACE BAY HIGH SCHOOL         ,668
2013-2014,51,CAPE BRETON-VICTORIA REGIONAL ,964,HARBOURSIDE ELEMENTARY SCHOOL ,378
2013-2014,51,CAPE BRETON-VICTORIA REGIONAL ,549,JOHN BERNARD CROAK V. C. MEMORIAL SCHOOL  ,191
2013-2014,51,CAPE BRETON-VICTORIA REGIONAL ,960,JUBILEE ELEMENTARY SCHOOL     ,217
2013-2014,51,CAPE BRETON-VICTORIA REGIONAL ,545,MACDONALD ELEMENTARY SCHOOL         ,152
2013-2014,51,CAPE BRETON-VICTORIA REGIONAL ,206,MACLENNAN MIDDLE SCHOOL       ,127
2013-2014,51,CAPE BRETON-VICTORIA REGIONAL ,202,MALCOLM MUNROE MEMORIAL MIDDLE SCHOOL     ,536
2013-2014,51,CAPE BRETON-VICTORIA REGIONAL ,183,MARION BRIDGE SCHOOL          ,80
2013-2014,51,CAPE BRETON-VICTORIA REGIONAL ,82,MEMORIAL COMPOSITE HIGH SCHOOL,840
2013-2014,51,CAPE BRETON-VICTORIA REGIONAL ,83,MIDDLE RIVER CONSOLIDATED SCHOOL     ,23
2013-2014,51,CAPE BRETON-VICTORIA REGIONAL ,180,MIRA ROAD SCHOOL              ,141
2013-2014,51,CAPE BRETON-VICTORIA REGIONAL ,643,MOUNT CARMEL ELEMENTARY SCHOOL,132
2013-2014,51,CAPE BRETON-VICTORIA REGIONAL ,997,MOUNTAINVIEW ELEMENTARY SCHOOL,248
2013-2014,51,CAPE BRETON-VICTORIA REGIONAL ,963,NEW WATERFORD ELEMENTARY SCHOOL ,356
2013-2014,51,CAPE BRETON-VICTORIA REGIONAL ,961,NORTH HIGHLANDS ELEMENTARY SCHOOL    ,83
2013-2014,51,CAPE BRETON-VICTORIA REGIONAL ,1154,OCEANVIEW EDUCATION CENTRE    ,535
2013-2014,51,CAPE BRETON-VICTORIA REGIONAL ,1142,RANKIN SCHOOL OF THE NARROWS  ,143
2013-2014,51,CAPE BRETON-VICTORIA REGIONAL ,973,RIVERSIDE ELEMENTARY SCHOOL   ,184
2013-2014,51,CAPE BRETON-VICTORIA REGIONAL ,203,RIVERVIEW HIGH SCHOOL         ,949
2013-2014,51,CAPE BRETON-VICTORIA REGIONAL ,182,ROBIN FOOTE ELEMENTARY SCHOOL ,141
2013-2014,51,CAPE BRETON-VICTORIA REGIONAL ,113,SETON ELEMENTARY SCHOOL       ,156
2013-2014,51,CAPE BRETON-VICTORIA REGIONAL ,646,SHERWOOD PARK EDUCATION CENTRE,287
2013-2014,51,CAPE BRETON-VICTORIA REGIONAL ,972,SHIPYARD ELEMENTARY SCHOOL    ,227
2013-2014,51,CAPE BRETON-VICTORIA REGIONAL ,644,ST. AGNES ELEMENTARY SCHOOL   ,131
2013-2014,51,CAPE BRETON-VICTORIA REGIONAL ,561,ST. ANNE'S ELEMENTARY SCHOOL  ,307
2013-2014,51,CAPE BRETON-VICTORIA REGIONAL ,119,ST. JOSEPH ELEMENTARY SCHOOL  ,197
2013-2014,51,CAPE BRETON-VICTORIA REGIONAL ,688,SYDNEY ACADEMY                ,698
2013-2014,51,CAPE BRETON-VICTORIA REGIONAL ,117,SYDNEY MINES MIDDLE SCHOOL    ,298
2013-2014,51,CAPE BRETON-VICTORIA REGIONAL ,185,SYDNEY RIVER ELEMENTARY SCHOOL,319
2013-2014,51,CAPE BRETON-VICTORIA REGIONAL ,110,THOMPSON MIDDLE SCHOOL        ,178
2013-2014,51,CAPE BRETON-VICTORIA REGIONAL ,175,TOMPKINS MEMORIAL ELEMENTARY SCHOOL  ,153
2013-2014,51,CAPE BRETON-VICTORIA REGIONAL ,667,WHITNEY PIER MEMORIAL MIDDLE SCHOOL  ,389
2013-2014,52,STRAIT REGIONAL               ,934,ANTIGONISH EDUCATION CENTRE     ,496
2013-2014,52,STRAIT REGIONAL               ,932,BAYVIEW EDUCATION CENTRE      ,330
2013-2014,52,STRAIT REGIONAL               ,974,CAPE BRETON HIGHLANDS EDUCATION CENTRE/ACADEMY ,342
2013-2014,52,STRAIT REGIONAL               ,986,CHEDABUCTO EDUCATION CENTRE/GUYSBOROUGH ACADEMY,309
2013-2014,52,STRAIT REGIONAL               ,930,DALBRAE ACADEMY               ,252
2013-2014,52,STRAIT REGIONAL               ,707,DR. JOHN HUGH GILLIS REGIONAL HIGH SCHOOL ,726
2013-2014,52,STRAIT REGIONAL               ,975,EAST ANTIGONISH EDUCATION CENTRE/ACADEMY ,428
2013-2014,52,STRAIT REGIONAL               ,484,EAST RICHMOND EDUCATION CENTRE     ,262
2013-2014,52,STRAIT REGIONAL               ,266,FANNING EDUCATION CENTRE/CANSO ACADEMY,171
2013-2014,52,STRAIT REGIONAL               ,471,FELIX MARCHAND EDUCATION CENTRE ,110
2013-2014,52,STRAIT REGIONAL               ,143,H. M. MACDONALD ELEMENTARY SCHOOL  ,99
2013-2014,52,STRAIT REGIONAL               ,1106,INVERNESS EDUCATION CENTRE/ACADEMY ,287
2013-2014,52,STRAIT REGIONAL               ,631,MULGRAVE MEMORIAL EDUCATION CENTRE ,77
2013-2014,52,STRAIT REGIONAL               ,390,PLEASANT BAY SCHOOL           ,8
2013-2014,52,STRAIT REGIONAL               ,931,RICHMOND EDUCATION CENTRE/ACADEMY  ,477
2013-2014,52,STRAIT REGIONAL               ,152,ST. ANDREW JUNIOR HIGH SCHOOL ,577
2013-2014,52,STRAIT REGIONAL               ,149,ST. ANDREWS CONSOLIDATED SCHOOL    ,262
2013-2014,52,STRAIT REGIONAL               ,1160,ST. MARY'S EDUCATION CENTRE/ACADEMY,294
2013-2014,52,STRAIT REGIONAL               ,655,STRAIT AREA EDUCATION/RECREATION CENTRE   ,365
2013-2014,52,STRAIT REGIONAL               ,8052,STRAIT DSEPS                  ,1
2013-2014,52,STRAIT REGIONAL               ,936,TAMARAC EDUCATION CENTRE      ,590
2013-2014,52,STRAIT REGIONAL               ,388,WHYCOCOMAGH EDUCATION CENTRE  ,165
2013-2014,53,CHIGNECTO-CENTRAL REGIONAL    ,639,A.G. BAILLIE MEMORIAL SCHOOL,378
2013-2014,53,CHIGNECTO-CENTRAL REGIONAL    ,634,ACADIA ST ELEMENTARY SCHOOL,145
2013-2014,53,CHIGNECTO-CENTRAL REGIONAL    ,248,ADVOCATE DISTRICT SCHOOL      ,55
2013-2014,53,CHIGNECTO-CENTRAL REGIONAL    ,705,AMHERST REGIONAL HIGH SCHOOL  ,677
2013-2014,53,CHIGNECTO-CENTRAL REGIONAL    ,6,BIBLE HILL CENTRAL ELEMENTARY SCHOOL ,165
2013-2014,53,CHIGNECTO-CENTRAL REGIONAL    ,2,BIBLE HILL EAST COURT ROAD ELEMENTARY SCHOOL,102
2013-2014,53,CHIGNECTO-CENTRAL REGIONAL    ,7,BIBLE HILL JUNIOR HIGH SCHOOL ,336
2013-2014,53,CHIGNECTO-CENTRAL REGIONAL    ,16,BROOKFIELD ELEMENTARY SCHOOL  ,176
2013-2014,53,CHIGNECTO-CENTRAL REGIONAL    ,20,CENTRAL COLCHESTER JUNIOR HIGH SCHOOL,436
2013-2014,53,CHIGNECTO-CENTRAL REGIONAL    ,27,CHIGANOIS ELEMENTARY SCHOOL   ,208
2013-2014,53,CHIGNECTO-CENTRAL REGIONAL    ,8053,CHIGNECTO-CENTRAL DSEPS       ,22
2013-2014,53,CHIGNECTO-CENTRAL REGIONAL    ,14,COBEQUID CONSOLIDATED ELEMENTARY SCHOOL     ,154
2013-2014,53,CHIGNECTO-CENTRAL REGIONAL    ,36,COBEQUID DISTRICT ELEMENTARY SCHOOL,82
2013-2014,53,CHIGNECTO-CENTRAL REGIONAL    ,44,COBEQUID EDUCATIONAL CENTRE   ,1493
2013-2014,53,CHIGNECTO-CENTRAL REGIONAL    ,1104,CUMBERLAND NORTH ACADEMY      ,308
2013-2014,53,CHIGNECTO-CENTRAL REGIONAL    ,230,CYRUS EATON ELEMENTARY SCHOOL ,119
2013-2014,53,CHIGNECTO-CENTRAL REGIONAL    ,28,DEBERT ELEMENTARY SCHOOL      ,142
2013-2014,53,CHIGNECTO-CENTRAL REGIONAL    ,408,DR. W. A. MACLEOD CONSOLIDATED SCHOOL,208
2013-2014,53,CHIGNECTO-CENTRAL REGIONAL    ,750,E. B. CHANDLER JUNIOR HIGH SCHOOL ,307
2013-2014,53,CHIGNECTO-CENTRAL REGIONAL    ,432,EAST PICTOU MIDDLE SCHOOL     ,202
2013-2014,53,CHIGNECTO-CENTRAL REGIONAL    ,31,ELMSDALE DISTRICT ELEMENTARY SCHOOL ,383
2013-2014,53,CHIGNECTO-CENTRAL REGIONAL    ,30,ENFIELD DISTRICT SCHOOL       ,301
2013-2014,53,CHIGNECTO-CENTRAL REGIONAL    ,414,F. H. MACDONALD ELEMENTARY SCHOOL ,308
2013-2014,53,CHIGNECTO-CENTRAL REGIONAL    ,665,G.R. SAUNDERS ELEMENTARY SCHOOL     ,361
2013-2014,53,CHIGNECTO-CENTRAL REGIONAL    ,26,GREAT VILLAGE ELEMENTARY SCHOOL      ,54
2013-2014,53,CHIGNECTO-CENTRAL REGIONAL    ,42,HANTS EAST RURAL HIGH SCHOOL  ,801
2013-2014,53,CHIGNECTO-CENTRAL REGIONAL    ,41,HANTS NORTH RURAL HIGH SCHOOL ,250
2013-2014,53,CHIGNECTO-CENTRAL REGIONAL    ,1145,HARMONY HEIGHTS ELEMENTARY SCHOOL   ,315
2013-2014,53,CHIGNECTO-CENTRAL REGIONAL    ,1100,HIGHLAND CONSOLIDATED MIDDLE SCHOOL ,262
2013-2014,53,CHIGNECTO-CENTRAL REGIONAL    ,15,HILDEN ELEMENTARY SCHOOL      ,100
2013-2014,53,CHIGNECTO-CENTRAL REGIONAL    ,661,JUNCTION ROAD ELEMENTARY SCHOOL     ,154
2013-2014,53,CHIGNECTO-CENTRAL REGIONAL    ,38,KENNETCOOK DISTRICT ELEMENTARY SCHOOL,87
2013-2014,53,CHIGNECTO-CENTRAL REGIONAL    ,35,MAITLAND DISTRICT SCHOOL             ,21
2013-2014,53,CHIGNECTO-CENTRAL REGIONAL    ,949,MAPLE RIDGE ELEMENTARY SCHOOL ,240
2013-2014,53,CHIGNECTO-CENTRAL REGIONAL    ,633,NEW GLASGOW JUNIOR HIGH SCHOOL       ,276
2013-2014,53,CHIGNECTO-CENTRAL REGIONAL    ,5,NORTH COLCHESTER HIGH SCHOOL  ,190
2013-2014,53,CHIGNECTO-CENTRAL REGIONAL    ,988,NORTH NOVA EDUCATION CENTRE   ,867
2013-2014,53,CHIGNECTO-CENTRAL REGIONAL    ,9,NORTH RIVER ELEMENTARY SCHOOL ,229
2013-2014,53,CHIGNECTO-CENTRAL REGIONAL    ,231,NORTHPORT CONSOLIDATED ELEMENTARY SCHOOL  ,44
2013-2014,53,CHIGNECTO-CENTRAL REGIONAL    ,989,NORTHUMBERLAND REGIONAL HIGH SCHOOL,881
2013-2014,53,CHIGNECTO-CENTRAL REGIONAL    ,1151,OXFORD REGIONAL EDUCATION CENTRE   ,387
2013-2014,53,CHIGNECTO-CENTRAL REGIONAL    ,649,PARRSBORO REGIONAL ELEMENTARY SCHOOL ,140
2013-2014,53,CHIGNECTO-CENTRAL REGIONAL    ,715,PARRSBORO REGIONAL HIGH SCHOOL,194
2013-2014,53,CHIGNECTO-CENTRAL REGIONAL    ,650,PICTOU ACADEMY/DR.THOMAS MCCULLOCH SCHOOL,268
2013-2014,53,CHIGNECTO-CENTRAL REGIONAL    ,971,PICTOU ELEMENTARY SCHOOL      ,209
2013-2014,53,CHIGNECTO-CENTRAL REGIONAL    ,252,PUGWASH DISTRICT HIGH SCHOOL  ,250
2013-2014,53,CHIGNECTO-CENTRAL REGIONAL    ,39,RAWDON DISTRICT ELEMENTARY SCHOOL    ,108
2013-2014,53,CHIGNECTO-CENTRAL REGIONAL    ,916,REDCLIFF MIDDLE SCHOOL        ,444
2013-2014,53,CHIGNECTO-CENTRAL REGIONAL    ,240,RIVER HEBERT DISTRICT ELEMENTARY SCHOOL   ,78
2013-2014,53,CHIGNECTO-CENTRAL REGIONAL    ,251,RIVER HEBERT DISTRICT SCHOOL  ,93
2013-2014,53,CHIGNECTO-CENTRAL REGIONAL    ,435,RIVER JOHN CONSOLIDATED SCHOOL       ,70
2013-2014,53,CHIGNECTO-CENTRAL REGIONAL    ,923,RIVERSIDE EDUCATION CENTRE    ,565
2013-2014,53,CHIGNECTO-CENTRAL REGIONAL    ,441,SALT SPRINGS ELEMENTARY SCHOOL       ,65
2013-2014,53,CHIGNECTO-CENTRAL REGIONAL    ,4,SCOTSBURN ELEMENTARY SCHOOL   ,113
2013-2014,53,CHIGNECTO-CENTRAL REGIONAL    ,34,SHUBENACADIE DISTRICT ELEMENTARY SCHOOL    ,162
2013-2014,53,CHIGNECTO-CENTRAL REGIONAL    ,992,SOUTH COLCHESTER ACADEMY      ,588
2013-2014,53,CHIGNECTO-CENTRAL REGIONAL    ,1105,SPRING STREET ACADEMY         ,502
2013-2014,53,CHIGNECTO-CENTRAL REGIONAL    ,658,SPRINGHILL JUNIOR-SENIOR HIGH SCHOOL ,313
2013-2014,53,CHIGNECTO-CENTRAL REGIONAL    ,1,TATAMAGOUCHE ELEMENTARY SCHOOL,177
2013-2014,53,CHIGNECTO-CENTRAL REGIONAL    ,636,TEMPERANCE STREET SCHOOL             ,96
2013-2014,53,CHIGNECTO-CENTRAL REGIONAL    ,428,THORBURN CONSOLIDATED SCHOOL  ,262
2013-2014,53,CHIGNECTO-CENTRAL REGIONAL    ,692,TRENTON ELEMENTARY SCHOOL     ,156
2013-2014,53,CHIGNECTO-CENTRAL REGIONAL    ,690,TRENTON MIDDLE SCHOOL         ,201
2013-2014,53,CHIGNECTO-CENTRAL REGIONAL    ,1146,TRURO ELEMENTARY SCHOOL       ,553
2013-2014,53,CHIGNECTO-CENTRAL REGIONAL    ,45,TRURO JUNIOR HIGH SCHOOL      ,423
2013-2014,53,CHIGNECTO-CENTRAL REGIONAL    ,40,UNIACKE DISTRICT SCHOOL       ,423
2013-2014,53,CHIGNECTO-CENTRAL REGIONAL    ,18,UPPER STEWIACKE ELEMENTARY SCHOOL   ,51
2013-2014,53,CHIGNECTO-CENTRAL REGIONAL    ,12,VALLEY ELEMENTARY SCHOOL      ,204
2013-2014,53,CHIGNECTO-CENTRAL REGIONAL    ,227,WALLACE CONSOLIDATED ELEMENTARY SCHOOL     ,58
2013-2014,53,CHIGNECTO-CENTRAL REGIONAL    ,3,WALTER DUGGAN CONSOLIDATED SCHOOL    ,438
2013-2014,53,CHIGNECTO-CENTRAL REGIONAL    ,229,WENTWORTH CONSOLIDATED ELEMENTARY SCHOOL ,22
2013-2014,53,CHIGNECTO-CENTRAL REGIONAL    ,29,WEST COLCHESTER CONSOLIDATED SCHOOL ,122
2013-2014,53,CHIGNECTO-CENTRAL REGIONAL    ,662,WEST END MEMORIAL SCHOOL      ,145
2013-2014,53,CHIGNECTO-CENTRAL REGIONAL    ,503,WEST HIGHLANDS ELEMENTARY SCHOOL     ,172
2013-2014,53,CHIGNECTO-CENTRAL REGIONAL    ,407,WEST PICTOU CONSOLIDATED SCHOOL      ,458
2013-2014,53,CHIGNECTO-CENTRAL REGIONAL    ,1148,WINDING RIVER CONSOLIDATED SCHOOL   ,244
2013-2014,54,HALIFAX REGIONAL              ,228,A. J. SMELTZER JUNIOR HIGH SCHOOL  ,247
2013-2014,54,HALIFAX REGIONAL              ,512,ADMIRAL WESTPHAL ELEMENTARY SCHOOL  ,105
2013-2014,54,HALIFAX REGIONAL              ,513,ALDERNEY ELEMENTARY SCHOOL    ,104
2013-2014,54,HALIFAX REGIONAL              ,317,ASH LEE JEFFERSON ELEMENTARY SCHOOL,522
2013-2014,54,HALIFAX REGIONAL              ,739,ASTRAL DRIVE ELEMENTARY SCHOOL,519
2013-2014,54,HALIFAX REGIONAL              ,749,ASTRAL DRIVE JUNIOR HIGH SCHOOL,470
2013-2014,54,HALIFAX REGIONAL              ,425,ATLANTIC MEMORIAL-TERENCE BAY SCHOOL      ,232
2013-2014,54,HALIFAX REGIONAL              ,326,ATLANTIC VIEW ELEMENTARY SCHOOL    ,128
2013-2014,54,HALIFAX REGIONAL              ,97,AUBURN DRIVE HIGH SCHOOL      ,938
2013-2014,54,HALIFAX REGIONAL              ,104,BASINVIEW DRIVE COMMUNITY SCHOOL    ,557
2013-2014,54,HALIFAX REGIONAL              ,752,BEAVER BANK MONARCH DRIVE ELEMENTARY SCHOOL,354
2013-2014,54,HALIFAX REGIONAL              ,304,BEAVER BANK-KINSAC ELEMENTARY SCHOOL,264
2013-2014,54,HALIFAX REGIONAL              ,268,BEDFORD AND FORSYTH EDUCATION CENTRES  ,224
2013-2014,54,HALIFAX REGIONAL              ,937,BEDFORD SOUTH SCHOOL          ,458
2013-2014,54,HALIFAX REGIONAL              ,291,BEECHVILLE LAKESIDE TIMBERLEA JUNIOR ELEMENTARY SCHOOL  ,380
2013-2014,54,HALIFAX REGIONAL              ,290,BEECHVILLE LAKESIDE TIMBERLEA SENIOR ELEMENTARY SCHOOL  ,354
2013-2014,54,HALIFAX REGIONAL              ,514,BEL AYR ELEMENTARY SCHOOL     ,204
2013-2014,54,HALIFAX REGIONAL              ,322,BELL PARK ACADEMIC CENTRE     ,220
2013-2014,54,HALIFAX REGIONAL              ,515,BICENTENNIAL SCHOOL           ,300
2013-2014,54,HALIFAX REGIONAL              ,519,BROOKHOUSE ELEMENTARY SCHOOL  ,360
2013-2014,54,HALIFAX REGIONAL              ,286,BROOKSIDE JUNIOR HIGH SCHOOL  ,342
2013-2014,54,HALIFAX REGIONAL              ,595,BURTON ETTINGER ELEMENTARY SCHOOL    ,374
2013-2014,54,HALIFAX REGIONAL              ,319,CALDWELL ROAD ELEMENTARY SCHOOL,297
2013-2014,54,HALIFAX REGIONAL              ,516,CALEDONIA JUNIOR HIGH SCHOOL  ,299
2013-2014,54,HALIFAX REGIONAL              ,312,CAUDLE PARK ELEMENTARY SCHOOL ,170
2013-2014,54,HALIFAX REGIONAL              ,743,CAVALIER DRIVE SCHOOL         ,334
2013-2014,54,HALIFAX REGIONAL              ,611,CENTRAL SPRYFIELD SCHOOL      ,149
2013-2014,54,HALIFAX REGIONAL              ,1183,CHARLES P. ALLEN HIGH SCHOOL  ,1331
2013-2014,54,HALIFAX REGIONAL              ,596,CHEBUCTO HEIGHTS ELEMENTARY SCHOOL   ,280
2013-2014,54,HALIFAX REGIONAL              ,1109,CITADEL HIGH SCHOOL           ,1261
2013-2014,54,HALIFAX REGIONAL              ,600,CLAYTON PARK JUNIOR HIGH SCHOOL     ,312
2013-2014,54,HALIFAX REGIONAL              ,352,COLBY VILLAGE ELEMENTARY SCHOOL      ,179
2013-2014,54,HALIFAX REGIONAL              ,357,COLE HARBOUR DISTRICT HIGH SCHOOL   ,846
2013-2014,54,HALIFAX REGIONAL              ,339,COLONEL JOHN STUART ELEMENTARY SCHOOL,175
2013-2014,54,HALIFAX REGIONAL              ,517,CRICHTON PARK ELEMENTARY SCHOOL      ,232
2013-2014,54,HALIFAX REGIONAL              ,605,CUNARD JUNIOR HIGH SCHOOL     ,199
2013-2014,54,HALIFAX REGIONAL              ,518,DARTMOUTH HIGH SCHOOL         ,847
2013-2014,54,HALIFAX REGIONAL              ,601,DUC D'ANVILLE ELEMENTARY SCHOOL      ,305
2013-2014,54,HALIFAX REGIONAL              ,328,DUNCAN MACMILLAN HIGH SCHOOL  ,202
2013-2014,54,HALIFAX REGIONAL              ,343,DUTCH SETTLEMENT ELEMENTARY SCHOOL  ,108
2013-2014,54,HALIFAX REGIONAL              ,283,EAST ST. MARGARET'S ELEMENTARY SCHOOL      ,62
2013-2014,54,HALIFAX REGIONAL              ,329,EASTERN CONSOLIDATED ELEMENTARY SCHOOL     ,7
2013-2014,54,HALIFAX REGIONAL              ,351,EASTERN PASSAGE EDUCATION CENTRE   ,416
2013-2014,54,HALIFAX REGIONAL              ,334,EASTERN SHORE DISTRICT HIGH SCHOOL ,498
2013-2014,54,HALIFAX REGIONAL              ,614,ELIZABETH SUTHERLAND SCHOOL   ,274
2013-2014,54,HALIFAX REGIONAL              ,538,ELLENVALE JUNIOR HIGH SCHOOL  ,369
2013-2014,54,HALIFAX REGIONAL              ,564,ERIC GRAVES MEMORIAL JUNIOR HIGH SCHOOL  ,160
2013-2014,54,HALIFAX REGIONAL              ,599,FAIRVIEW HEIGHTS ELEMENTARY SCHOOL  ,265
2013-2014,54,HALIFAX REGIONAL              ,578,FAIRVIEW JUNIOR HIGH SCHOOL   ,379
2013-2014,54,HALIFAX REGIONAL              ,288,FIVE BRIDGES JUNIOR HIGH SCHOOL     ,528
2013-2014,54,HALIFAX REGIONAL              ,356,GAETZ BROOK JUNIOR HIGH SCHOOL,309
2013-2014,54,HALIFAX REGIONAL              ,731,GEORGE BISSETT ELEMENTARY SCHOOL   ,152
2013-2014,54,HALIFAX REGIONAL              ,314,GEORGES P. VANIER JUNIOR HIGH SCHOOL,396
2013-2014,54,HALIFAX REGIONAL              ,350,GERTRUDE M. PARKER ELEMENTARY SCHOOL ,244
2013-2014,54,HALIFAX REGIONAL              ,568,GORSEBROOK JUNIOR HIGH SCHOOL ,191
2013-2014,54,HALIFAX REGIONAL              ,318,GRAHAM CREIGHTON JUNIOR HIGH SCHOOL  ,305
2013-2014,54,HALIFAX REGIONAL              ,602,GROSVENOR-WENTWORTH PARK ELEMENTARY SCHOOL ,489
2013-2014,54,HALIFAX REGIONAL              ,567,HALIFAX CENTRAL JUNIOR HIGH SCHOOL,183
2013-2014,54,HALIFAX REGIONAL              ,8054,HALIFAX DSEPS                 ,155
2013-2014,54,HALIFAX REGIONAL              ,592,HALIFAX WEST HIGH SCHOOL      ,1452
2013-2014,54,HALIFAX REGIONAL              ,306,HAMMONDS PLAINS CONSOLIDATED SCHOOL ,643
2013-2014,54,HALIFAX REGIONAL              ,521,HARBOUR VIEW ELEMENTARY SCHOOL,224
2013-2014,54,HALIFAX REGIONAL              ,740,HAROLD T. BARRETT JUNIOR HIGH SCHOOL,181
2013-2014,54,HALIFAX REGIONAL              ,296,HARRIETSFIELD ELEMENTARY SCHOOL      ,159
2013-2014,54,HALIFAX REGIONAL              ,313,HARRY R. HAMILTON ELEMENTARY SCHOOL ,517
2013-2014,54,HALIFAX REGIONAL              ,522,HAWTHORN ELEMENTARY SCHOOL    ,220
2013-2014,54,HALIFAX REGIONAL              ,293,HERRING COVE JUNIOR HIGH SCHOOL      ,210
2013-2014,54,HALIFAX REGIONAL              ,571,HIGHLAND PARK JUNIOR HIGH SCHOOL     ,125
2013-2014,54,HALIFAX REGIONAL              ,310,HILLSIDE PARK ELEMENTARY SCHOOL      ,180
2013-2014,54,HALIFAX REGIONAL              ,747,HOLLAND ROAD ELEMENTARY SCHOOL,305
2013-2014,54,HALIFAX REGIONAL              ,327,HUMBER PARK ELEMENTARY SCHOOL ,174
2013-2014,54,HALIFAX REGIONAL              ,523,IAN FORSYTH ELEMENTARY SCHOOL ,347
2013-2014,54,HALIFAX REGIONAL              ,579,INGLIS STREET ELEMENTARY SCHOOL      ,192
2013-2014,54,HALIFAX REGIONAL              ,619,J. L. ILSLEY HIGH SCHOOL      ,740
2013-2014,54,HALIFAX REGIONAL              ,539,JOHN MACNEIL ELEMENTARY SCHOOL,213
2013-2014,54,HALIFAX REGIONAL              ,524,JOHN MARTIN JUNIOR HIGH SCHOOL,180
2013-2014,54,HALIFAX REGIONAL              ,607,JOHN W. MACLEOD-FLEMING TOWER ELEMENTARY SCHOOL ,400
2013-2014,54,HALIFAX REGIONAL              ,354,JOSEPH GILES ELEMENTARY SCHOOL,257
2013-2014,54,HALIFAX REGIONAL              ,569,JOSEPH HOWE ELEMENTARY SCHOOL ,131
2013-2014,54,HALIFAX REGIONAL              ,1103,KINGSWOOD ELEMENTARY SCHOOL   ,547
2013-2014,54,HALIFAX REGIONAL              ,330,LAKEFRONT CONSOLIDATED ELEMENTARY SCHOOL   ,35
2013-2014,54,HALIFAX REGIONAL              ,587,LEMARCHANT-ST. THOMAS ELEMENTARY SCHOOL    ,389
2013-2014,54,HALIFAX REGIONAL              ,353,LESLIE THOMAS JUNIOR HIGH SCHOOL   ,257
2013-2014,54,HALIFAX REGIONAL              ,968,LOCKVIEW HIGH SCHOOL          ,1176
2013-2014,54,HALIFAX REGIONAL              ,939,MADELINE SYMONDS MIDDLE SCHOOL,671
2013-2014,54,HALIFAX REGIONAL              ,526,MICHAEL WALLACE ELEMENTARY SCHOOL    ,218
2013-2014,54,HALIFAX REGIONAL              ,748,MILLWOOD ELEMENTARY SCHOOL    ,394
2013-2014,54,HALIFAX REGIONAL              ,745,MILLWOOD HIGH SCHOOL          ,612
2013-2014,54,HALIFAX REGIONAL              ,527,MOUNT EDWARD ELEMENTARY SCHOOL,175
2013-2014,54,HALIFAX REGIONAL              ,1149,MUSQUODOBOIT RURAL HIGH SCHOOL,279
2013-2014,54,HALIFAX REGIONAL              ,348,MUSQUODOBOIT VALLEY EDUCATION CENTRE ,146
2013-2014,54,HALIFAX REGIONAL              ,324,NELSON WHYNDER ELEMENTARY SCHOOL     ,94
2013-2014,54,HALIFAX REGIONAL              ,56,OCEAN VIEW ELEMENTARY SCHOOL  ,297
2013-2014,54,HALIFAX REGIONAL              ,131,O'CONNELL DRIVE ELEMENTARY SCHOOL   ,353
2013-2014,54,HALIFAX REGIONAL              ,315,OLDFIELD CONSOLIDATED SCHOOL  ,122
2013-2014,54,HALIFAX REGIONAL              ,572,OXFORD SCHOOL                 ,324
2013-2014,54,HALIFAX REGIONAL              ,1141,OYSTER POND ACADEMY           ,396
2013-2014,54,HALIFAX REGIONAL              ,970,PARK WEST SCHOOL              ,785
2013-2014,54,HALIFAX REGIONAL              ,1159,PORTERS LAKE ELEMENTARY SCHOOL,350
2013-2014,54,HALIFAX REGIONAL              ,969,PORTLAND ESTATES ELEMENTARY SCHOOL   ,368
2013-2014,54,HALIFAX REGIONAL              ,533,PRINCE ANDREW HIGH SCHOOL     ,977
2013-2014,54,HALIFAX REGIONAL              ,532,PRINCE ARTHUR JUNIOR HIGH SCHOOL     ,305
2013-2014,54,HALIFAX REGIONAL              ,282,PROSPECT ROAD ELEMENTARY SCHOOL     ,256
2013-2014,54,HALIFAX REGIONAL              ,938,RIDGECLIFF MIDDLE SCHOOL      ,469
2013-2014,54,HALIFAX REGIONAL              ,359,ROBERT K. TURNER ELEMENTARY SCHOOL   ,131
2013-2014,54,HALIFAX REGIONAL              ,603,ROCKINGHAM ELEMENTARY SCHOOL  ,402
2013-2014,54,HALIFAX REGIONAL              ,609,ROCKINGSTONE HEIGHTS SCHOOL   ,246
2013-2014,54,HALIFAX REGIONAL              ,1187,ROCKY LAKE JUNIOR HIGH SCHOOL ,606
2013-2014,54,HALIFAX REGIONAL              ,321,ROSS ROAD SCHOOL              ,290
2013-2014,54,HALIFAX REGIONAL              ,309,SACKVILLE CENTENNIAL ELEMENTARY SCHOOL    ,67
2013-2014,54,HALIFAX REGIONAL              ,311,SACKVILLE HEIGHTS ELEMENTARY SCHOOL,335
2013-2014,54,HALIFAX REGIONAL              ,303,SACKVILLE HEIGHTS JUNIOR HIGH SCHOOL ,549
2013-2014,54,HALIFAX REGIONAL              ,297,SACKVILLE HIGH SCHOOL         ,732
2013-2014,54,HALIFAX REGIONAL              ,581,SAINT MARY'S ELEMENTARY SCHOOL,100
2013-2014,54,HALIFAX REGIONAL              ,295,SAMBRO ELEMENTARY SCHOOL      ,120
2013-2014,54,HALIFAX REGIONAL              ,941,SEASIDE ELEMENTARY SCHOOL     ,325
2013-2014,54,HALIFAX REGIONAL              ,534,SHANNON PARK ELEMENTARY SCHOOL,515
2013-2014,54,HALIFAX REGIONAL              ,287,SHATFORD MEMORIAL ELEMENTARY SCHOOL  ,79
2013-2014,54,HALIFAX REGIONAL              ,332,SHEET HARBOUR CONSOLIDATED SCHOOL    ,111
2013-2014,54,HALIFAX REGIONAL              ,589,SIR CHARLES TUPPER SCHOOL     ,236
2013-2014,54,HALIFAX REGIONAL              ,277,SIR JOHN A. MACDONALD HIGH SCHOOL   ,967
2013-2014,54,HALIFAX REGIONAL              ,320,SIR ROBERT BORDEN JUNIOR HIGH SCHOOL ,217
2013-2014,54,HALIFAX REGIONAL              ,355,SMOKEY DRIVE ELEMENTARY SCHOOL,222
2013-2014,54,HALIFAX REGIONAL              ,535,SOUTH WOODSIDE SCHOOL         ,154
2013-2014,54,HALIFAX REGIONAL              ,540,SOUTHDALE-NORTH WOODSIDE SCHOOL      ,274
