Year,Board Code,Board Name,School Code,School Name,School Total
2015-2016,58,SOUTH SHORE REGIONAL          ,386,DR. JOHN C. WICKWIRE ACADEMY  ,392
2015-2016,58,SOUTH SHORE REGIONAL          ,80,FOREST HEIGHTS COMMUNITY SCHOOL  ,351
2015-2016,58,SOUTH SHORE REGIONAL          ,1150,GREENFIELD ELEMENTARY SCHOOL  ,30
2015-2016,58,SOUTH SHORE REGIONAL          ,917,HEBBVILLE ACADEMY             ,535
2015-2016,58,SOUTH SHORE REGIONAL          ,710,LIVERPOOL REGIONAL HIGH SCHOOL,376
2015-2016,58,SOUTH SHORE REGIONAL          ,397,NEW GERMANY ELEMENTARY SCHOOL ,177
2015-2016,58,SOUTH SHORE REGIONAL          ,402,NEW GERMANY RURAL HIGH SCHOOL ,356
2015-2016,58,SOUTH SHORE REGIONAL          ,214,NEW ROSS CONSOLIDATED SCHOOL  ,86
2015-2016,58,SOUTH SHORE REGIONAL          ,404,NEWCOMBVILLE ELEMENTARY SCHOOL,155
2015-2016,58,SOUTH SHORE REGIONAL          ,459,NORTH QUEENS COMMUNITY SCHOOL ,238
2015-2016,58,SOUTH SHORE REGIONAL          ,409,PARK VIEW EDUCATION CENTRE    ,712
2015-2016,58,SOUTH SHORE REGIONAL          ,400,PENTZ ELEMENTARY SCHOOL       ,83
2015-2016,58,SOUTH SHORE REGIONAL          ,401,PETITE RIVIERE ELEMENTARY SCHOOL     ,76
2015-2016,58,SOUTH SHORE REGIONAL          ,1185,SOUTH QUEENS MIDDLE SCHOOL    ,221
2015-2016,58,SOUTH SHORE REGIONAL          ,1171,SSRSB ADULT HIGH SCHOOL       ,56
2015-2016,58,SOUTH SHORE REGIONAL          ,1172,SSRSB ALTERNATE PROGRAMS      ,24
2015-2016,58,SOUTH SHORE REGIONAL          ,394,WEST NORTHFIELD ELEMENTARY SCHOOL   ,137
2015-2016,59,TRI-COUNTY REGIONAL           ,500,ARCADIA CONSOLIDATED ELEMENTARY SCHOOL   ,147
2015-2016,59,TRI-COUNTY REGIONAL           ,167,BARRINGTON MUNICIPAL HIGH SCHOOL     ,487
2015-2016,59,TRI-COUNTY REGIONAL           ,255,BARTON CONSOLIDATED SCHOOL    ,62
2015-2016,59,TRI-COUNTY REGIONAL           ,497,CARLETON CONSOLIDATED SCHOOL  ,96
2015-2016,59,TRI-COUNTY REGIONAL           ,511,CLARK'S HARBOUR ELEMENTARY SCHOOL    ,191
2015-2016,59,TRI-COUNTY REGIONAL           ,541,DIGBY ELEMENTARY SCHOOL       ,313
2015-2016,59,TRI-COUNTY REGIONAL           ,257,DIGBY NECK CONSOLIDATED SCHOOL,29
2015-2016,59,TRI-COUNTY REGIONAL           ,709,DIGBY REGIONAL HIGH SCHOOL         ,440
2015-2016,59,TRI-COUNTY REGIONAL           ,981,DRUMLIN HEIGHTS CONSOLIDATED SCHOOL ,361
2015-2016,59,TRI-COUNTY REGIONAL           ,733,EVELYN RICHARDSON MEMORIAL ELEMENTARY SCHOOL ,102
2015-2016,59,TRI-COUNTY REGIONAL           ,927,FOREST RIDGE ACADEMY          ,178
2015-2016,59,TRI-COUNTY REGIONAL           ,79,HILLCREST ACADEMY             ,276
2015-2016,59,TRI-COUNTY REGIONAL           ,259,ISLANDS CONSOLIDATED SCHOOL   ,117
2015-2016,59,TRI-COUNTY REGIONAL           ,624,LOCKEPORT ELEMENTARY SCHOOL   ,104
2015-2016,59,TRI-COUNTY REGIONAL           ,711,LOCKEPORT REGIONAL HIGH SCHOOL      ,95
2015-2016,59,TRI-COUNTY REGIONAL           ,410,MAPLE GROVE EDUCATION CENTRE  ,377
2015-2016,59,TRI-COUNTY REGIONAL           ,928,MEADOWFIELDS COMMUNITY SCHOOL ,444
2015-2016,59,TRI-COUNTY REGIONAL           ,199,PLYMOUTH SCHOOL               ,98
2015-2016,59,TRI-COUNTY REGIONAL           ,498,PORT MAITLAND CONSOLIDATED SCHOOL  ,124
2015-2016,59,TRI-COUNTY REGIONAL           ,716,SHELBURNE REGIONAL HIGH SCHOOL,269
2015-2016,59,TRI-COUNTY REGIONAL           ,703,SOUTH CENTENNIAL SCHOOL       ,77
2015-2016,59,TRI-COUNTY REGIONAL           ,977,ST. MARY'S BAY ACADEMY        ,260
2015-2016,59,TRI-COUNTY REGIONAL           ,8059,TRI-COUNTY DSEPS              ,13
2015-2016,59,TRI-COUNTY REGIONAL           ,256,WEYMOUTH CONSOLIDATED SCHOOL  ,186
2015-2016,59,TRI-COUNTY REGIONAL           ,704,YARMOUTH CENTRAL SCHOOL       ,204
2015-2016,59,TRI-COUNTY REGIONAL           ,1178,YARMOUTH CONSOLIDATED MEMORIAL HIGH SCHOOL   ,866
2016-2017,54,HALIFAX REGIONAL              ,592,HALIFAX WEST HIGH SCHOOL           ,1508
2016-2017,55,ANNAPOLIS VALLEY REGIONAL     ,360,THREE MILE PLAINS DISTRICT SCHOOL      ,150
2016-2017,55,ANNAPOLIS VALLEY REGIONAL     ,54,ST. MARY'S ELEMENTARY SCHOOL          ,180
2016-2017,53,CHIGNECTO-CENTRAL REGIONAL    ,690,TRENTON MIDDLE SCHOOL                 ,124
2016-2017,55,ANNAPOLIS VALLEY REGIONAL     ,62,KINGSTON & DISTRICT SCHOOL             ,483
2016-2017,54,HALIFAX REGIONAL              ,601,DUC D'ANVILLE ELEMENTARY SCHOOL      ,356
2016-2017,59,TRI-COUNTY REGIONAL           ,1178,YARMOUTH CONS MEMORIAL HIGH SCHOOL   ,826
2016-2017,57,ACADIEN PROVINCIAL            ,57,COLE ROSE-DES-VENTS          ,202
2016-2017,57,ACADIEN PROVINCIAL            ,744,COLE BELLEVILLE              ,204
2016-2017,54,HALIFAX REGIONAL              ,343,DUTCH SETTLEMENT ELEMENTARY SCHOOL   ,133
2016-2017,53,CHIGNECTO-CENTRAL REGIONAL    ,251,RIVER HEBERT DISTRICT SCHOOL    ,182
2016-2017,54,HALIFAX REGIONAL              ,747,HOLLAND ROAD ELEMENTARY SCHOOL       ,297
2016-2017,51,CAPE BRETON-VICTORIA REGIONAL ,117,SYDNEY MINES MIDDLE SCHOOL           ,235
2016-2017,52,STRAIT REGIONAL               ,266,FANNING EDUCATION CENTRE/CANSO ACADEMY,169
2016-2017,54,HALIFAX REGIONAL              ,299,SUNNYSIDE ELEMENTARY SCHOOL           ,357
2016-2017,55,ANNAPOLIS VALLEY REGIONAL     ,67,CENTRAL KINGS RURAL HIGH SCHOOL        ,691
2016-2017,54,HALIFAX REGIONAL              ,569,JOSEPH HOWE ELEMENTARY SCHOOL        ,199
2016-2017,53,CHIGNECTO-CENTRAL REGIONAL    ,715,PARRSBORO REGIONAL HIGH SCHOOL       ,154
2016-2017,54,HALIFAX REGIONAL              ,603,ROCKINGHAM ELEMENTARY SCHOOL         ,477
2016-2017,59,TRI-COUNTY REGIONAL           ,704,YARMOUTH CENTRAL SCHOOL              ,307
2016-2017,54,HALIFAX REGIONAL              ,312,CAUDLE PARK ELEMENTARY SCHOOL      ,201
2016-2017,54,HALIFAX REGIONAL              ,297,SACKVILLE HIGH SCHOOL                 ,882
2016-2017,51,CAPE BRETON-VICTORIA REGIONAL ,972,SHIPYARD ELEMENTARY SCHOOL                ,235
2016-2017,53,CHIGNECTO-CENTRAL REGIONAL    ,28,DEBERT ELEMENTARY SCHOOL                        ,145
2016-2017,54,HALIFAX REGIONAL              ,354,JOSEPH GILES ELEMENTARY SCHOOL       ,241
2016-2017,53,CHIGNECTO-CENTRAL REGIONAL    ,1190,WEST HIGHLANDS ELEMENTARY SCHOOL      ,271
2016-2017,51,CAPE BRETON-VICTORIA REGIONAL ,549,JOHN BERNARD CROAK V. C. MEMORIAL SCHOOL  ,203
2016-2017,54,HALIFAX REGIONAL              ,277,SIR JOHN A. MACDONALD HIGH SCHOOL     ,919
2016-2017,51,CAPE BRETON-VICTORIA REGIONAL ,101,BRAS D'OR ELEMENTARY SCHOOL               ,217
2016-2017,51,CAPE BRETON-VICTORIA REGIONAL ,997,MOUNTAINVIEW ELEMENTARY SCHOOL,231
2016-2017,54,HALIFAX REGIONAL              ,568,GORSEBROOK JUNIOR HIGH SCHOOL        ,218
2016-2017,57,ACADIEN PROVINCIAL            ,982,COLE BEAU-PORT               ,248
2016-2017,52,STRAIT REGIONAL               ,1106,INVERNESS EDUCATION CENTRE/ACADEMY ,253
2016-2017,54,HALIFAX REGIONAL              ,579,INGLIS STREET ELEMENTARY SCHOOL      ,181
2016-2017,51,CAPE BRETON-VICTORIA REGIONAL ,964,HARBOURSIDE ELEMENTARY SCHOOL             ,329
2016-2017,55,ANNAPOLIS VALLEY REGIONAL     ,379,KINGS COUNTY ADULT HIGH SCHOOL,43
2016-2017,54,HALIFAX REGIONAL              ,283,EAST ST. MARGARET'S ELEMENTARY SCHOOL      ,66
2016-2017,53,CHIGNECTO-CENTRAL REGIONAL    ,971,PICTOU ELEMENTARY SCHOOL             ,174
2016-2017,53,CHIGNECTO-CENTRAL REGIONAL    ,407,WEST PICTOU CONSOLIDATED SCHOOL       ,505
2016-2017,51,CAPE BRETON-VICTORIA REGIONAL ,83,MIDDLE RIVER CONSOLIDATED SCHOOL          ,10
2016-2017,59,TRI-COUNTY REGIONAL           ,498,PORT MAITLAND CONSOLIDATED SCHOOL    ,128
2016-2017,52,STRAIT REGIONAL               ,484,EAST RICHMOND EDUCATION CENTRE     ,250
2016-2017,52,STRAIT REGIONAL               ,143,H. M. MACDONALD ELEMENTARY SCHOOL,111
2016-2017,53,CHIGNECTO-CENTRAL REGIONAL    ,5,NORTH COLCHESTER HIGH SCHOOL         ,216
2016-2017,51,CAPE BRETON-VICTORIA REGIONAL ,96,BADDECK ACADEMY               ,248
2016-2017,54,HALIFAX REGIONAL              ,611,CENTRAL SPRYFIELD SCHOOL             ,159
2016-2017,59,TRI-COUNTY REGIONAL           ,711,LOCKEPORT REGIONAL HIGH SCHOOL       ,91
2016-2017,54,HALIFAX REGIONAL              ,324,NELSON WHYNDER ELEMENTARY SCHOOL     ,79
2016-2017,51,CAPE BRETON-VICTORIA REGIONAL ,1154,OCEANVIEW EDUCATION CENTRE    ,598
2016-2017,54,HALIFAX REGIONAL              ,619,J. L. ILSLEY HIGH SCHOOL      ,664
2016-2017,54,HALIFAX REGIONAL              ,589,SIR CHARLES TUPPER SCHOOL          ,184
2016-2017,58,SOUTH SHORE REGIONAL          ,1150,GREENFIELD ELEMENTARY SCHOOL         ,31
2016-2017,55,ANNAPOLIS VALLEY REGIONAL     ,58,CAMBRIDGE AND DISTRICT ELEMENTARY SCHOOL     ,165
2016-2017,57,ACADIEN PROVINCIAL            ,156,COLE PUBNICO-OUEST           ,137
2016-2017,55,ANNAPOLIS VALLEY REGIONAL     ,141,CLARK RUTHERFORD MEMORIAL SCHOOL       ,151
2016-2017,55,ANNAPOLIS VALLEY REGIONAL     ,376,WINDSOR ADULT HIGH SCHOOL     ,41
2016-2017,51,CAPE BRETON-VICTORIA REGIONAL ,186,COXHEATH ELEMENTARY SCHOOL                ,289
2016-2017,59,TRI-COUNTY REGIONAL           ,733,EVELYN RICHARDSON MEMORIAL ELEMENTARY SCHOOL ,97
2016-2017,53,CHIGNECTO-CENTRAL REGIONAL    ,38,KENNETCOOK DISTRICT ELEMENTARY SCHOOL             ,102
2016-2017,57,ACADIEN PROVINCIAL            ,225,COLE SECONDAIRE DE CLARE     ,263
2016-2017,54,HALIFAX REGIONAL              ,97,AUBURN DRIVE HIGH SCHOOL      ,813
2016-2017,58,SOUTH SHORE REGIONAL          ,508,BRIDGEWATER JUNIOR SENIOR HIGH SCHOOL,438
2016-2017,53,CHIGNECTO-CENTRAL REGIONAL    ,662,WEST END MEMORIAL SCHOOL              ,114
2016-2017,53,CHIGNECTO-CENTRAL REGIONAL    ,949,MAPLE RIDGE ELEMENTARY SCHOOL        ,254
2016-2017,54,HALIFAX REGIONAL              ,523,IAN FORSYTH ELEMENTARY SCHOOL        ,318
2016-2017,57,ACADIEN PROVINCIAL            ,947,COLE BEAUBASSIN              ,630
2016-2017,54,HALIFAX REGIONAL              ,296,HARRIETSFIELD ELEMENTARY SCHOOL            ,156
2016-2017,51,CAPE BRETON-VICTORIA REGIONAL ,646,SHERWOOD PARK EDUCATION CENTRE     ,373
2016-2017,54,HALIFAX REGIONAL              ,317,ASH-LEE JEFFERSON ELEMENTARY SCHOOL   ,505
2016-2017,59,TRI-COUNTY REGIONAL           ,79,HILLCREST ACADEMY             ,286
2016-2017,54,HALIFAX REGIONAL              ,322,BELL PARK ACADEMIC CENTRE     ,222
2016-2017,53,CHIGNECTO-CENTRAL REGIONAL    ,988,NORTH NOVA EDUCATION CENTRE   ,940
2016-2017,51,CAPE BRETON-VICTORIA REGIONAL ,960,JUBILEE ELEMENTARY SCHOOL                 ,361
2016-2017,51,CAPE BRETON-VICTORIA REGIONAL ,416,GLACE BAY ELEMENTARY SCHOOL              ,403
2016-2017,52,STRAIT REGIONAL               ,655,STRAIT AREA EDUCATION/RECREATION CENTRE   ,346
2016-2017,54,HALIFAX REGIONAL              ,538,ELLENVALE JUNIOR HIGH SCHOOL         ,373
2016-2017,54,HALIFAX REGIONAL              ,1183,CHARLES P. ALLEN HIGH SCHOOL             ,1323
2016-2017,55,ANNAPOLIS VALLEY REGIONAL     ,65,DWIGHT ROSS ELEMENTARY SCHOOL          ,156
2016-2017,54,HALIFAX REGIONAL              ,295,SAMBRO ELEMENTARY SCHOOL              ,99
2016-2017,55,ANNAPOLIS VALLEY REGIONAL     ,75,BERWICK AND DISTRICT SCHOOL            ,275
2016-2017,54,HALIFAX REGIONAL              ,1103,KINGSWOOD ELEMENTARY SCHOOL   ,529
2016-2017,53,CHIGNECTO-CENTRAL REGIONAL    ,1,TATAMAGOUCHE ELEMENTARY SCHOOL    ,224
2016-2017,55,ANNAPOLIS VALLEY REGIONAL     ,699,WINDSOR ELEMENTARY SCHOOL              ,211
2016-2017,55,ANNAPOLIS VALLEY REGIONAL     ,72,PORT WILLIAMS ELEMENTARY SCHOOL        ,224
2016-2017,54,HALIFAX REGIONAL              ,941,SEASIDE ELEMENTARY SCHOOL             ,355
2016-2017,57,ACADIEN PROVINCIAL            ,217,COLE JOSEPH-DUGAS            ,81
2016-2017,54,HALIFAX REGIONAL              ,586,ST. STEPHEN'S ELEMENTARY SCHOOL       ,217
2016-2017,58,SOUTH SHORE REGIONAL          ,509,BRIDGEWATER ELEMENTARY SCHOOL        ,446
2016-2017,51,CAPE BRETON-VICTORIA REGIONAL ,1169,CBVRSB ADULT HIGH SCHOOL      ,96
2016-2017,55,ANNAPOLIS VALLEY REGIONAL     ,366,DR. ARTHUR HINES SCHOOL                ,98
2016-2017,51,CAPE BRETON-VICTORIA REGIONAL ,8,GLACE BAY HIGH SCHOOL                    ,820
2016-2017,54,HALIFAX REGIONAL              ,752,BEAVER BANK-MONARCH DRIVE ELEMENTARY SCHOOL ,341
2016-2017,54,HALIFAX REGIONAL              ,56,OCEAN VIEW ELEMENTARY SCHOOL        ,303
2016-2017,57,ACADIEN PROVINCIAL            ,378,COLE NDA                     ,159
2016-2017,58,SOUTH SHORE REGIONAL          ,1156,BLUENOSE ACADEMY              ,512
2016-2017,55,ANNAPOLIS VALLEY REGIONAL     ,24,HANTSPORT SCHOOL                       ,173
2016-2017,51,CAPE BRETON-VICTORIA REGIONAL ,185,SYDNEY RIVER ELEMENTARY SCHOOL           ,235
2016-2017,54,HALIFAX REGIONAL              ,1187,ROCKY LAKE JUNIOR HIGH SCHOOL        ,689
2016-2017,58,SOUTH SHORE REGIONAL          ,402,NEW GERMANY RURAL HIGH SCHOOL        ,338
2016-2017,54,HALIFAX REGIONAL              ,287,SHATFORD MEMORIAL ELEMENTARY SCHOOL   ,88
2016-2017,57,ACADIEN PROVINCIAL            ,68,COLE DU CARREFOUR            ,483
2016-2017,59,TRI-COUNTY REGIONAL           ,977,ST. MARY'S BAY ACADEMY        ,256
2016-2017,54,HALIFAX REGIONAL              ,533,PRINCE ANDREW HIGH SCHOOL,788
2016-2017,54,HALIFAX REGIONAL              ,1109,CITADEL HIGH SCHOOL                  ,1257
2016-2017,54,HALIFAX REGIONAL              ,313,HARRY R. HAMILTON ELEMENTARY SCHOOL  ,432
2016-2017,58,SOUTH SHORE REGIONAL          ,207,CHESTER DISTRICT ELEMENTARY SCHOOL   ,282
2016-2017,54,HALIFAX REGIONAL              ,535,SOUTH WOODSIDE SCHOOL                 ,135
2016-2017,53,CHIGNECTO-CENTRAL REGIONAL    ,231,NORTHPORT CONSOLIDATED ELEMENTARY SCHOOL        ,45
2016-2017,54,HALIFAX REGIONAL              ,607,JOHN W. MACLEOD-FLEMING TOWER ELEMENTARY SCHOOL ,415
2016-2017,54,HALIFAX REGIONAL              ,539,JOHN MACNEIL ELEMENTARY SCHOOL       ,227
2016-2017,57,ACADIEN PROVINCIAL            ,1152,COLE SECONDAIRE DU SOMMET    ,498
2016-2017,58,SOUTH SHORE REGIONAL          ,394,WEST NORTHFIELD ELEMENTARY SCHOOL          ,133
2016-2017,54,HALIFAX REGIONAL              ,1157,WAVERLEY MEMORIAL ELEMENTARY SCHOOL    ,346
2016-2017,54,HALIFAX REGIONAL              ,321,ROSS ROAD SCHOOL                     ,270
2016-2017,54,HALIFAX REGIONAL              ,268,BEDFORD AND FORSYTH EDUCATION CENTRES  ,203
2016-2017,55,ANNAPOLIS VALLEY REGIONAL     ,81,WOLFVILLE SCHOOL                       ,282
2016-2017,54,HALIFAX REGIONAL              ,332,SHEET HARBOUR CONSOLIDATED SCHOOL     ,97
2016-2017,54,HALIFAX REGIONAL              ,319,CALDWELL ROAD ELEMENTARY SCHOOL    ,318
2016-2017,53,CHIGNECTO-CENTRAL REGIONAL    ,1105,SPRING STREET ACADEMY         ,418
2016-2017,54,HALIFAX REGIONAL              ,286,BROOKSIDE JUNIOR HIGH SCHOOL       ,322
2016-2017,58,SOUTH SHORE REGIONAL          ,401,PETITE RIVIRE ELEMENTARY SCHOOL           ,71
2016-2017,54,HALIFAX REGIONAL              ,593,SPRINGVALE ELEMENTARY SCHOOL          ,301
2016-2017,53,CHIGNECTO-CENTRAL REGIONAL    ,14,COBEQUID CONSOLIDATED ELEMENTARY SCHOOL            ,166
2016-2017,53,CHIGNECTO-CENTRAL REGIONAL    ,661,JUNCTION ROAD ELEMENTARY SCHOOL         ,155
2016-2017,53,CHIGNECTO-CENTRAL REGIONAL    ,45,TRURO JUNIOR HIGH SCHOOL              ,436
2016-2017,54,HALIFAX REGIONAL              ,288,FIVE BRIDGES JUNIOR HIGH SCHOOL      ,601
2016-2017,51,CAPE BRETON-VICTORIA REGIONAL ,962,CAPE SMOKEY ELEMENTARY SCHOOL             ,86
2016-2017,53,CHIGNECTO-CENTRAL REGIONAL    ,40,UNIACKE DISTRICT SCHOOL               ,417
2016-2017,54,HALIFAX REGIONAL              ,131,O'CONNELL DRIVE ELEMENTARY SCHOOL    ,319
2016-2017,53,CHIGNECTO-CENTRAL REGIONAL    ,8053,CHIGNECTO-CENTRAL DSEPS (Tuition Students),35
2016-2017,53,CHIGNECTO-CENTRAL REGIONAL    ,650,PICTOU ACADEMY-DR.THOMAS MCCULLOCH SCHOOL,241
2016-2017,55,ANNAPOLIS VALLEY REGIONAL     ,8055,ANNAPOLIS VALLEY DSEPS (Tuition Students),34
2016-2017,52,STRAIT REGIONAL               ,149,ST. ANDREWS CONSOLIDATED SCHOOL     ,267
2016-2017,58,SOUTH SHORE REGIONAL          ,917,HEBBVILLE ACADEMY             ,530
2016-2017,55,ANNAPOLIS VALLEY REGIONAL     ,732,COLDBROOK AND DISTRICT SCHOOL          ,433
2016-2017,54,HALIFAX REGIONAL              ,518,DARTMOUTH HIGH SCHOOL                ,943
2016-2017,58,SOUTH SHORE REGIONAL          ,926,BAYVIEW COMMUNITY SCHOOL      ,425
2016-2017,54,HALIFAX REGIONAL              ,1159,PORTERS LAKE ELEMENTARY SCHOOL       ,283
2016-2017,59,TRI-COUNTY REGIONAL           ,541,DIGBY ELEMENTARY SCHOOL              ,322
2016-2017,57,ACADIEN PROVINCIAL            ,221,COLE SAINT-ALBERT            ,46
2016-2017,54,HALIFAX REGIONAL              ,334,EASTERN SHORE DISTRICT HIGH SCHOOL   ,416
2016-2017,53,CHIGNECTO-CENTRAL REGIONAL    ,9,NORTH RIVER ELEMENTARY SCHOOL        ,221
2016-2017,52,STRAIT REGIONAL               ,631,MULGRAVE MEMORIAL EDUCATION CENTRE ,29
2016-2017,53,CHIGNECTO-CENTRAL REGIONAL    ,916,REDCLIFF MIDDLE SCHOOL                ,391
2016-2017,53,CHIGNECTO-CENTRAL REGIONAL    ,692,TRENTON ELEMENTARY SCHOOL             ,153
2016-2017,54,HALIFAX REGIONAL              ,353,LESLIE THOMAS JUNIOR HIGH SCHOOL     ,329
2016-2017,54,HALIFAX REGIONAL              ,968,LOCKVIEW HIGH SCHOOL                 ,1152
2016-2017,53,CHIGNECTO-CENTRAL REGIONAL    ,4,SCOTSBURN ELEMENTARY SCHOOL          ,101
2016-2017,54,HALIFAX REGIONAL              ,327,HUMBER PARK ELEMENTARY SCHOOL        ,147
2016-2017,54,HALIFAX REGIONAL              ,512,ADMIRAL WESTPHAL ELEMENTARY SCHOOL  ,119
2016-2017,53,CHIGNECTO-CENTRAL REGIONAL    ,27,CHIGANOIS ELEMENTARY SCHOOL                     ,191
2016-2017,51,CAPE BRETON-VICTORIA REGIONAL ,1101,CUSACK SCHOOL                 ,319
2016-2017,54,HALIFAX REGIONAL              ,580,ST. JOSEPH'S-ALEXANDER MCKAY ELEMENTARY SCHOOL   ,256
2016-2017,59,TRI-COUNTY REGIONAL           ,410,MAPLE GROVE EDUCATION CENTRE  ,382
2016-2017,53,CHIGNECTO-CENTRAL REGIONAL    ,665,G. R. SAUNDERS ELEMENTARY SCHOOL    ,349
2016-2017,59,TRI-COUNTY REGIONAL           ,259,ISLANDS CONSOLIDATED SCHOOL          ,101
2016-2017,58,SOUTH SHORE REGIONAL          ,404,NEWCOMBVILLE ELEMENTARY SCHOOL       ,156
2016-2017,53,CHIGNECTO-CENTRAL REGIONAL    ,923,RIVERSIDE EDUCATION CENTRE    ,555
2016-2017,57,ACADIEN PROVINCIAL            ,219,COLE STELLA-MARIS            ,80
2016-2017,57,ACADIEN PROVINCIAL            ,1188,COLE DU GRAND-PORTAGE        ,215
2016-2017,52,STRAIT REGIONAL               ,390,PLEASANT BAY SCHOOL           ,7
2016-2017,55,ANNAPOLIS VALLEY REGIONAL     ,361,WINDSOR FORKS SCHOOL                   ,117
2016-2017,59,TRI-COUNTY REGIONAL           ,8059,TRI-COUNTY DSEPS (Tuition Students),6
2016-2017,54,HALIFAX REGIONAL              ,306,HAMMONDS PLAINS CONSOLIDATED SCHOOL  ,640
2016-2017,59,TRI-COUNTY REGIONAL           ,709,DIGBY REGIONAL HIGH SCHOOL           ,436
2016-2017,54,HALIFAX REGIONAL              ,315,OLDFIELD CONSOLIDATED SCHOOL         ,142
2016-2017,54,HALIFAX REGIONAL              ,572,OXFORD SCHOOL                        ,384
2016-2017,53,CHIGNECTO-CENTRAL REGIONAL    ,44,COBEQUID EDUCATIONAL CENTRE   ,1401
2016-2017,55,ANNAPOLIS VALLEY REGIONAL     ,129,LAWRENCETOWN CONSOLIDATED SCHOOL  ,115
2016-2017,54,HALIFAX REGIONAL              ,748,MILLWOOD ELEMENTARY SCHOOL           ,359
2016-2017,53,CHIGNECTO-CENTRAL REGIONAL    ,12,VALLEY ELEMENTARY SCHOOL                       ,216
2016-2017,52,STRAIT REGIONAL               ,986,CHEDABUCTO EDUCATION CENTRE/GUYSBOROUGH ACADEMY,311
2016-2017,52,STRAIT REGIONAL               ,974,CAPE BRETON HIGHLANDS EDUCATION CENTRE/ACADEMY ,301
2016-2017,55,ANNAPOLIS VALLEY REGIONAL     ,55,SOMERSET AND DISTRICT ELEMENTARY SCHOOL     ,162
2016-2017,53,CHIGNECTO-CENTRAL REGIONAL    ,29,WEST COLCHESTER CONSOLIDATED SCHOOL   ,117
2016-2017,58,SOUTH SHORE REGIONAL          ,459,NORTH QUEENS COMMUNITY SCHOOL       ,230
2016-2017,55,ANNAPOLIS VALLEY REGIONAL     ,362,FALMOUTH DISTRICT SCHOOL               ,188
2016-2017,55,ANNAPOLIS VALLEY REGIONAL     ,133,ANNAPOLIS WEST EDUCATION CENTRE ,362
2016-2017,53,CHIGNECTO-CENTRAL REGIONAL    ,1189,NEW GLASGOW ACADEMY           ,533
2016-2017,54,HALIFAX REGIONAL              ,739,ASTRAL DRIVE ELEMENTARY SCHOOL        ,462
2016-2017,58,SOUTH SHORE REGIONAL          ,405,BIG TANCOOK ELEMENTARY SCHOOL       ,3
2016-2017,54,HALIFAX REGIONAL              ,939,MADELINE SYMONDS MIDDLE SCHOOL,728
2016-2017,54,HALIFAX REGIONAL              ,104,BASINVIEW DRIVE COMMUNITY SCHOOL      ,616
2016-2017,54,HALIFAX REGIONAL              ,527,MOUNT EDWARD ELEMENTARY SCHOOL      ,166
2016-2017,54,HALIFAX REGIONAL              ,519,BROOKHOUSE ELEMENTARY SCHOOL         ,365
2016-2017,58,SOUTH SHORE REGIONAL          ,409,PARK VIEW EDUCATION CENTRE    ,706
2016-2017,54,HALIFAX REGIONAL              ,743,CAVALIER DRIVE SCHOOL                ,325
2016-2017,58,SOUTH SHORE REGIONAL          ,710,LIVERPOOL REGIONAL HIGH SCHOOL       ,335
2016-2017,54,HALIFAX REGIONAL              ,425,ATLANTIC MEMORIAL-TERENCE BAY SCHOOL       ,215
2016-2017,53,CHIGNECTO-CENTRAL REGIONAL    ,428,THORBURN CONSOLIDATED SCHOOL          ,232
2016-2017,51,CAPE BRETON-VICTORIA REGIONAL ,1153,FERRISVIEW ELEMENTARY SCHOOL     ,208
2016-2017,54,HALIFAX REGIONAL              ,355,SMOKEY DRIVE ELEMENTARY SCHOOL        ,251
2016-2017,53,CHIGNECTO-CENTRAL REGIONAL    ,1145,HARMONY HEIGHTS ELEMENTARY SCHOOL       ,332
2016-2017,55,ANNAPOLIS VALLEY REGIONAL     ,59,GLOOSCAP ELEMENTARY SCHOOL             ,204
2016-2017,54,HALIFAX REGIONAL              ,731,GEORGE BISSETT ELEMENTARY SCHOOL    ,141
2016-2017,55,ANNAPOLIS VALLEY REGIONAL     ,1158,KINGS COUNTY ACADEMY          ,620
2016-2017,55,ANNAPOLIS VALLEY REGIONAL     ,965,CHAMPLAIN ELEMENTARY SCHOOL            ,171
2016-2017,51,CAPE BRETON-VICTORIA REGIONAL ,183,MARION BRIDGE SCHOOL                  ,71
2016-2017,53,CHIGNECTO-CENTRAL REGIONAL    ,36,COBEQUID DISTRICT ELEMENTARY SCHOOL        ,73
2016-2017,52,STRAIT REGIONAL               ,388,WHYCOCOMAGH EDUCATION CENTRE  ,165
2016-2017,53,CHIGNECTO-CENTRAL REGIONAL    ,31,ELMSDALE DISTRICT ELEMENTARY SCHOOL             ,378
2016-2017,59,TRI-COUNTY REGIONAL           ,511,CLARK'S HARBOUR ELEMENTARY SCHOOL    ,191
2016-2017,52,STRAIT REGIONAL               ,931,RICHMOND EDUCATION CENTRE/ACADEMY  ,409
2016-2017,53,CHIGNECTO-CENTRAL REGIONAL    ,441,SALT SPRINGS ELEMENTARY SCHOOL        ,70
2016-2017,55,ANNAPOLIS VALLEY REGIONAL     ,993,AVON VIEW HIGH SCHOOL                  ,889
2016-2017,53,CHIGNECTO-CENTRAL REGIONAL    ,408,DR. W. A. MACLEOD ELEMENTARY SCHOOL,493
2016-2017,53,CHIGNECTO-CENTRAL REGIONAL    ,230,CYRUS EATON ELEMENTARY SCHOOL        ,144
2016-2017,53,CHIGNECTO-CENTRAL REGIONAL    ,227,WALLACE CONSOLIDATED ELEMENTARY SCHOOL     ,44
2016-2017,58,SOUTH SHORE REGIONAL          ,1171,SSRSB ADULT HIGH SCHOOL       ,63
2016-2017,54,HALIFAX REGIONAL              ,540,SOUTHDALE-NORTH WOODSIDE SCHOOL       ,464
2016-2017,53,CHIGNECTO-CENTRAL REGIONAL    ,989,NORTHUMBERLAND REGIONAL HIGH SCHOOL,842
2016-2017,54,HALIFAX REGIONAL              ,1149,MUSQUODOBOIT RURAL HIGH SCHOOL       ,265
2016-2017,54,HALIFAX REGIONAL              ,1186,TANTALLON JUNIOR ELEMENTARY SCHOOL   ,305
2016-2017,53,CHIGNECTO-CENTRAL REGIONAL    ,1146,TRURO ELEMENTARY SCHOOL               ,562
2016-2017,53,CHIGNECTO-CENTRAL REGIONAL    ,15,HILDEN ELEMENTARY SCHOOL                           ,111
2016-2017,51,CAPE BRETON-VICTORIA REGIONAL ,1142,RANKIN SCHOOL OF THE NARROWS  ,135
2016-2017,54,HALIFAX REGIONAL              ,291,BEECHVILLE LAKESIDE TIMBERLEA JUNIOR ELEMENTARY SCHOOL         ,387
2016-2017,52,STRAIT REGIONAL               ,8052,STRAIT DSEPS (Tuition Students),1
2016-2017,58,SOUTH SHORE REGIONAL          ,1185,SOUTH QUEENS MIDDLE SCHOOL    ,221
2016-2017,51,CAPE BRETON-VICTORIA REGIONAL ,82,MEMORIAL COMPOSITE HIGH SCHOOL          ,1002
2016-2017,54,HALIFAX REGIONAL              ,740,HAROLD T. BARRETT JUNIOR HIGH SCHOOL ,207
2016-2017,54,HALIFAX REGIONAL              ,303,SACKVILLE HEIGHTS JUNIOR HIGH SCHOOL  ,539
2016-2017,54,HALIFAX REGIONAL              ,577,ST. CATHERINE'S ELEMENTARY SCHOOL     ,453
2016-2017,54,HALIFAX REGIONAL              ,578,FAIRVIEW JUNIOR HIGH SCHOOL         ,432
2016-2017,59,TRI-COUNTY REGIONAL           ,927,FOREST RIDGE ACADEMY          ,187
2016-2017,59,TRI-COUNTY REGIONAL           ,928,MEADOWFIELDS COMMUNITY SCHOOL ,436
2016-2017,53,CHIGNECTO-CENTRAL REGIONAL    ,750,E. B. CHANDLER JUNIOR HIGH SCHOOL  ,318
2016-2017,54,HALIFAX REGIONAL              ,587,LEMARCHANT-ST. THOMAS ELEMENTARY SCHOOL    ,427
2016-2017,54,HALIFAX REGIONAL              ,293,HERRING COVE JUNIOR HIGH SCHOOL      ,221
2016-2017,51,CAPE BRETON-VICTORIA REGIONAL ,995,BROOKLAND ELEMENTARY SCHOOL               ,325
2016-2017,54,HALIFAX REGIONAL              ,524,JOHN MARTIN JUNIOR HIGH SCHOOL       ,158
2016-2017,54,HALIFAX REGIONAL              ,307,SYCAMORE LANE ELEMENTARY SCHOOL       ,177
2016-2017,54,HALIFAX REGIONAL              ,320,SIR ROBERT BORDEN JUNIOR HIGH SCHOOL  ,204
2016-2017,53,CHIGNECTO-CENTRAL REGIONAL    ,42,HANTS EAST RURAL HIGH SCHOOL            ,735
2016-2017,51,CAPE BRETON-VICTORIA REGIONAL ,93,BOULARDERIE ELEMENTARY SCHOOL       ,73
2016-2017,58,SOUTH SHORE REGIONAL          ,397,NEW GERMANY ELEMENTARY SCHOOL        ,195
2016-2017,54,HALIFAX REGIONAL              ,600,CLAYTON PARK JUNIOR HIGH SCHOOL      ,339
2016-2017,53,CHIGNECTO-CENTRAL REGIONAL    ,414,F. H. MACDONALD ELEMENTARY SCHOOL   ,283
2016-2017,54,HALIFAX REGIONAL              ,513,ALDERNEY ELEMENTARY SCHOOL                      ,120
2016-2017,52,STRAIT REGIONAL               ,934,ANTIGONISH EDUCATION CENTRE ,500
2016-2017,54,HALIFAX REGIONAL              ,567,HALIFAX CENTRAL JUNIOR HIGH SCHOOL,168
2016-2017,54,HALIFAX REGIONAL              ,351,EASTERN PASSAGE EDUCATION CENTRE   ,431
2016-2017,53,CHIGNECTO-CENTRAL REGIONAL    ,20,CENTRAL COLCHESTER JUNIOR HIGH SCHOOL,402
2016-2017,54,HALIFAX REGIONAL              ,85,TALLAHASSEE COMMUNITY SCHOOL  ,469
2016-2017,53,CHIGNECTO-CENTRAL REGIONAL    ,1148,WINDING RIVER CONSOLIDATED SCHOOL     ,250
